ticker,site,headline,date
TSLA,nytimes,Tesla's Troubles Mount: Shuttered Showrooms and Sinking,2019-03-06
TSLA,nytimes,"Self-Driving Tesla Was Involved in Fatal Crash, U.S. Says",2016-06-30
TSLA,nytimes,"Tesla Reports New Setback for Model 3, With Output Lagging",2018-01-03
TSLA,nytimes,Tesla Sales Slump as '19 Starts Is Hinted At in State Data,2019-03-22
TSLA,nytimes,How Did G.M. Create Tesla's Dream Car First?,2016-09-14
TSLA,nytimes,"Tesla's First Mass-Market Car, the Model 3, Hits Production",2017-07-03
TSLA,nytimes,"Tesla Model 3 Goes Upscale, and Base-Price Buyers Must",2018-05-21
TSLA,nytimes,Elon Musk Details 'Excruciating' Personal Toll of Tesla,2018-08-16
TSLA,nytimes,Tesla to Halt Production of Model 3 Cars Temporarily,2018-04-16
TSLA,nytimes,Tesla Passes Ford in Market Value as Investors Bet on the,2017-04-03
TSLA,nytimes,Unraveling a Tesla Mystery: Lots (and Lots) of Parked Cars,2018-10-01
TSLA,nytimes,"Elon Musk Says Tesla May Go Private, and Its Stock Soars",2018-08-07
TSLA,nytimes,Tesla Posts Big Quarterly Loss as Its Electric-Car Sales Lag,2019-04-24
TSLA,nytimes,Tesla Scrambles to Sell Cars Before a Tax Break Fades,2018-12-28
TSLA,nytimes,Tesla's Market Surge Has Even Fans Looking for Feet of Clay,2017-04-11
TSLA,nytimes,Tesla Upgrades Autopilot in Cars on the Road,2016-09-23
TSLA,nytimes,"Porsche Positions Itself Against Tesla, on the Road and",2018-03-06
TSLA,nytimes,"'I Think This Guy Is, Like, Passed Out in His Tesla'",2019-11-27
TSLA,nytimes,Tesla Seeks to Raise $2 Billion in Sale of Stock and Debt,2019-05-02
TSLA,nytimes,What Tesla's 'Delivery Logistics Hell' Is Like for Model 3,2018-11-15
TSLA,nytimes,Tesla Model 3 Orders Surge Even Before Its Unveiling,2016-04-01
TSLA,nytimes,"Elon Musk Rejects 'Boring, Bonehead Questions,' and",2018-05-03
TSLA,nytimes,Inside the Self-Driving Tesla Fatal Accident,2016-07-12
TSLA,nytimes,"For Tesla, 'Production Hell' Looks Like the Reality of",2018-04-03
TSLA,nytimes,"From Tesla, a New Car Smell That Vegans Can Get Behind",2016-01-14
TSLA,nytimes,Tesla's Dangerous Sprint Into the Future,2017-11-07
TSLA,nytimes,"Tesla Ends Online Sales of $35000 Model 3, Creating",2019-04-12
TSLA,nytimes,"Tesla the Car Is a Household Name. Long Ago, So Was",2017-12-30
TSLA,nytimes,Model 3 Helps Tesla Send Quarterly Deliveries to a Record,2019-07-02
TSLA,nytimes,Tesla Says Never Mind: It Raises Prices and Keeps Most,2019-03-11
TSLA,nytimes,"Tesla's Tiered Pricing Is a Hurdle, but a Fair One",2017-10-27
TSLA,nytimes,"Menial Tasks, Slurs and Swastikas: Many Black Workers at",2018-11-30
TSLA,nytimes,Tesla Achieves a Key Weekly Goal for Producing Its Model 3,2018-07-02
TSLA,nytimes,Buying a Tesla Seems Pretty Easy. But There Are a Few,2019-04-12
TSLA,nytimes,"Tesla Fixes Model 3 Flaw, Getting Consumer Reports to",2018-05-30
TSLA,nytimes,"Tesla Reports a Rare Quarterly Profit, Its Biggest Ever",2018-10-24
TSLA,nytimes,"Tesla Reports Another Big Loss, but Sees Only Profit Ahead",2018-08-01
TSLA,nytimes,Fatal Tesla Crash Draws In Transportation Safety Board,2016-07-10
TSLA,nytimes,Fatal Tesla Crash Raises New Questions About Autopilot,2018-03-31
TSLA,nytimes,Tesla Reports Progress on Model 3 Car Production,2018-10-02
TSLA,nytimes,"Tesla Will Not Go Private, Elon Musk Says, Capping Month",2018-08-24
TSLA,nytimes,China's Answer to Tesla Is Hopeful Entrant to Global Car,2017-01-26
TSLA,nytimes,Betting Against Tesla: Short-Sellers Make Their Case,2018-09-17
TSLA,nytimes,Tesla's Top Lawyer Is Leaving. His Tenure at the Company,2019-02-20
TSLA,nytimes,Elon Musk's Pitch to Take Tesla Private Has Wall Street,2018-08-08
TSLA,nytimes,"Tesla, Reporting Bigger Loss, Emphasizes Gains in",2017-05-03
TSLA,nytimes,"Meet the Man Quietly Building the Tesla of Trucks, With Jeff",2019-07-02
TSLA,nytimes,"Tesla Delivers Model X, Its First Sport Utility Vehicle",2015-09-30
TSLA,nytimes,Tesla Loses Less Money as Model 3 Sales Surge,2019-07-24
TSLA,nytimes,Tesla Model S Suspension Failures Under Scrutiny by,2016-06-09
TSLA,nytimes,"Elon Musk Settled With the S.E.C., but Tesla's Troubles",2018-09-30
TSLA,nytimes,Elon Musk Predicts Tesla Driverless Taxi Fleet Next Year,2019-04-22
TSLA,nytimes,Tesla's Self-Driving System Cleared in Deadly Crash,2017-01-19
TSLA,nytimes,Tesla's Elon Musk May Have Boldest Pay Plan in,2018-01-23
TSLA,nytimes,Tesla Unveils an Electric Rival to Semi Trucks,2017-11-16
TSLA,nytimes,Tesla and Google Take Different Roads to Self-Driving Car,2016-07-04
TSLA,nytimes,Tesla's Latest Aim: Build 500000 Cars a Year in China,2018-07-10
TSLA,nytimes,A Police Tesla Nearly Ran Out of Power During a Chase. It,2019-10-03
TSLA,nytimes,"Amazon Invests in Rivian, a Tesla Rival in Electric Vehicles",2019-02-15
TSLA,nytimes,Tesla Fires Hundreds of Workers,2017-10-13
TSLA,nytimes,Tesla Chief Asks Makers to Support Electric Cars,2015-01-13
TSLA,nytimes,Tesla Names a Successor to Elon Musk as Board Chief,2018-11-08
TSLA,nytimes,Tesla Shaken by a Departure and What Elon Musk Was,2018-09-07
TSLA,nytimes,Tesla to Shrink Board of Directors by Four People,2019-04-19
TSLA,nytimes,Tesla Plant in China May Be a First,2017-10-22
TSLA,nytimes,"Tesla Motors Met Its Output Goal, but Showed a 4th-",2015-02-11
TSLA,nytimes,Consumer Reports Gives New Tesla Its Highest Score Ever,2015-08-27
TSLA,nytimes,Elon Musk's Effort to Take Tesla Private to Get Board,2018-08-14
TSLA,nytimes,Elon Musk Aims to Shore Up SolarCity by Having Tesla Buy It,2016-06-21
TSLA,nytimes,"Elon Musk's Tesla Plan: More Models, More Self-Driving",2016-07-21
TSLA,nytimes,A Question for Tesla's Board: What Was Elon Musk's,2018-08-15
TSLA,nytimes,Tesla Board Surprised by Elon Musk's Tweet on Taking,2018-08-13
TSLA,nytimes,He Drove a Tesla on Autopilot From the Passenger Seat.,2018-04-29
TSLA,nytimes,Justice Department Is Examining Tesla After Musk Comment,2018-09-18
TSLA,nytimes,Tesla Faces a Challenger in the Home Solar Business,2018-10-28
TSLA,nytimes,Tesla's 'Cybertruck',2019-11-27
TSLA,nytimes,Tesla to Cut 3000 Jobs in Bid to Sell Model 3 to Mass Market,2019-01-18
TSLA,nytimes,"Elon Musk and S.E.C. Reach New Accord, Lifting Cloud",2019-04-26
TSLA,nytimes,"Electric Vehicle Tax Credit Survives, but G.M. and Tesla",2018-01-11
TSLA,nytimes,"Elon Musk Says Never Mind the Hiccups, Tesla Is on Track",2015-11-03
TSLA,nytimes,Autopilot Cited in Death of Chinese Tesla Driver,2016-09-14
TSLA,nytimes,What Will a Contempt Hearing Mean for Tesla's Elon Musk?,2019-03-08
TSLA,nytimes,Tesla Says Crashed Vehicle Had Been on Autopilot Before,2018-03-31
TSLA,nytimes,"North Korea, Tesla, Taiwan: Your Thursday Briefing",2018-02-07
TSLA,nytimes,Walmart Says Tesla Solar Panels Set Fires Atop Stores,2019-08-22
TSLA,nytimes,"As U.S. Investigates Fatal Tesla Crash, Company Defends",2016-07-12
TSLA,nytimes,"For Tesla Owner, Losing a Wheel Was Just the First Surprise",2016-06-10
TSLA,nytimes,"Tesla Faults Brakes, but Not Autopilot, in Fatal Crash",2016-07-29
TSLA,nytimes,"Tesla Motors Trims Delivery Outlook, Sending Stock Down",2015-08-05
TSLA,nytimes,"Ford to Invest $500 Million in Rivian, a Tesla Rival",2019-04-24
TSLA,nytimes,Tesla Looks to Regain Its Luster in Solar Energy by,2019-04-30
TSLA,nytimes,How the S.E.C. Is Trying to Push Traditional Corporate,2018-10-01
TSLA,nytimes,"Tesla Boosts Car Battery Power During Irma, Raising",2017-09-11
TSLA,nytimes,Elon Musk Says Pending Tesla Updates Could Have,2016-09-11
TSLA,nytimes,DealBook Briefing: Tesla's Mass Market Hopes May,2018-02-07
TSLA,nytimes,Tesla Ventures Into Solar Power Storage for Home and,2015-05-01
TSLA,nytimes,Tesla Names Larry Ellison and Kathleen Wilson-Thompson,2018-12-28
TSLA,nytimes,"Elon Musk's Ultimatum to Tesla: Fight the S.E.C., or I Quit",2018-10-02
TSLA,nytimes,Elon Musk Makes Light of Tesla's Troubles in April Fool's,2018-04-01
TSLA,nytimes,Why Elon Musk Reversed Course on Taking Tesla Private,2018-08-25
TSLA,nytimes,Daily Report: Tesla Driver Dies in 'Autopilot' Accident,2016-07-01
TSLA,nytimes,"Porsche, Aiming at Tesla, Unveils Electric Concept Car",2015-09-14
TSLA,nytimes,U.S. Safety Agency Investigates Another Tesla Crash,2016-07-06
TSLA,nytimes,Tesla's Elon Musk and S.E.C. Have 2 Weeks to Resolve,2019-04-04
TSLA,nytimes,Opinion | SpaceX and Tesla Go Into Orbit,2018-02-12
TSLA,nytimes,Elon Musk Accuses Tesla Employee of Sabotage,2018-06-19
TSLA,nytimes,5 Takeaways From Elon Musk's Interview With The,2018-08-17
TSLA,nytimes,Tesla's Electric 'Cybertruck' Is Unveiled. It's Pointy,2019-11-22
TSLA,nytimes,'Tesla Nation' Review: A Documentary Celebrates Serbian-,2019-04-25
TSLA,nytimes,Tesla and Elon Musk Are Given Week to Reach Accord,2019-04-18
TSLA,nytimes,"Tesla Slashes Spending, and May Add to Its Troubles",2018-08-19
TSLA,nytimes,Tesla Self-Driving System Faulted by Safety Agency in Crash,2017-09-12
TSLA,nytimes,Tesla Factory Safety Under Scrutiny After Worker Is Injured,2018-04-20
TSLA,nytimes,Elon Musk Wants to Take Tesla Private. Can He Make,2018-08-23
TSLA,nytimes,"Everyone Despises SolarCity Deal, Except Tesla",2016-08-04
TSLA,nytimes,Consumer Reports Stops Recommending the Tesla,2015-10-20
TSLA,nytimes,Weekend at Elon's: A Tesla Subplot With Azealia Banks,2018-08-17
TSLA,nytimes,A Lesson of Tesla Crashes? Computer Vision Can't Do It,2016-09-19
TSLA,nytimes,Tesla to Investigate Car That Appeared to Burst Into,2019-04-22
TSLA,nytimes,"Elon Musk's No Good, Very Bad Year: A Tesla Timeline",2018-08-18
TSLA,nytimes,Tesla Gives the California Power Grid a Battery Boost,2017-01-30
TSLA,nytimes,¿Cómo creó primero General Motors el auto soñado de,2016-09-22
TSLA,nytimes,Tesla in Talks to Set Up Electric Car Factory in Shanghai,2017-06-22
TSLA,nytimes,Tesla's Winding Road to Berlin,2019-11-20
TSLA,nytimes,Tesla Comes to Brooklyn,2016-06-01
TSLA,nytimes,Tesla Is Going to Build a Factory Near Berlin,2019-11-13
TSLA,nytimes,Tesla Drivers Will Soon Find More Charging Stations in,2015-08-13
TSLA,nytimes,Tesla vs. Google: dos visiones distintas sobre el vehículo,2016-07-06
TSLA,nytimes,Tesla se encuentra cada vez más atribulada y le urge una,2018-04-02
TSLA,nytimes,Tesla Chief Elon Musk Is Sued by S.E.C. in Move That,2018-09-27
TSLA,nytimes,Elon Musk of Tesla Sticks to Mission Despite Setbacks,2016-07-24
TSLA,nytimes,"Elon Musk, a Serial Entrepreneur",2016-07-25
TSLA,nytimes,"'Elon Musk,' by Ashlee Vance",2015-05-12
TSLA,nytimes,"'Elon Musk,' a Biography by Ashlee Vance, Paints a Driven",2015-05-12
TSLA,nytimes,Interviewing Elon Musk,2018-08-19
TSLA,nytimes,"Want to Bring Back Jobs, Mr. President-Elect? Call Elon Musk",2016-12-05
TSLA,nytimes,Elon Musk Bids Twitter Farewell — Briefly,2019-11-05
TSLA,nytimes,"Elon Musk Has Trump's Ear, and Wall Street Takes Note",2017-01-26
TSLA,nytimes,Elon Musk's Neuralink Wants 'Sewing Machine-Like',2019-07-16
TSLA,nytimes,Elon Musk Is the Id of Tech,2018-08-16
TSLA,nytimes,DealBook Briefing: The Agony of Elon Musk,2018-08-17
TSLA,nytimes,The Future of Electric Cars Is Brighter With Elon Musk in It,2018-10-01
TSLA,nytimes,"Elon Musk's Plan: Get Humans to Mars, and Beyond",2016-09-27
TSLA,nytimes,"In Elon Musk's World, Brakes Are for Cars, Not C.E.O.s",2018-08-28
TSLA,nytimes,Elon Musk Calls S.E.C. 'the Shortseller Enrichment,2018-10-04
TSLA,nytimes,Will Anyone Buy Elon Musk's New Pickup?,2019-11-22
TSLA,nytimes,Elon Musk's Ex-Wife on What It Takes to Be a Mogul,2015-04-27
TSLA,nytimes,"Why Is Elon Musk Attacking the Media? We Explain. (Also,",2018-05-24
TSLA,nytimes,Elon Musk Ordered to Stand Trial in Cave Explorer's,2019-11-19
TSLA,nytimes,Elon Musk Wants to Fill Warren Buffett's 'Moat' With Candy,2018-05-07
TSLA,nytimes,Elon Musk Declares War on the Media: DealBook Briefing,2018-05-24
TSLA,nytimes,"Mark Zuckerberg, Elon Musk and the Feud Over Killer Robots",2018-06-09
TSLA,nytimes,Elon Musk Accuses the S.E.C. of Unconstitutional Censorship,2019-03-12
TSLA,nytimes,"In This Space Race, Jeff Bezos and Elon Musk Are",2018-04-24
TSLA,nytimes,Elon Musk Joins #DeleteFacebook With a Barrage of Tweets,2018-03-23
TSLA,nytimes,Elon Musk Steps Down as Chairman in Deal With S.E.C.,2018-09-29
TSLA,nytimes,Elon Musk Defends His Rejected Mini-Sub Plan for Thai,2018-07-10
TSLA,nytimes,29 Minutes From New York to Washington? Elon Musk,2017-07-20
TSLA,nytimes,Chicago Says Elon Musk's Boring Company to Build High-,2018-06-13
TSLA,nytimes,Elon Musk Sued by Cave Rescuer He Accused of Being a,2018-09-17
TSLA,nytimes,A.I. Researchers Leave Elon Musk Lab to Begin Robotics,2017-11-06
TSLA,nytimes,Elon Musk's Defense: 'Pedo Guy' Tweet Was a Generic Insult,2019-12-06
TSLA,nytimes,DealBook Briefing: Elon Musk Smoked Weed On Air,2018-09-07
TSLA,nytimes,What Elon Musk Should Learn From the Thailand Cave,2018-07-14
TSLA,nytimes,"It's Showtime for Elon Musk's Boring Co., With a Long Way",2018-12-18
TSLA,nytimes,Elon Musk's Chicago Tunnel: A Breakthrough or a Pipe,2018-09-16
TSLA,nytimes,A Tech Wunderkind Who Knows Jaden Smith and Elon Musk,2018-11-14
TSLA,nytimes,Elon Musk and Stephen Hawking Among Hundreds to,2015-07-27
TSLA,nytimes,Australia Powers Up the World's Biggest Battery,2017-11-30
TSLA,nytimes,"Noam Chomsky, Elon Musk and Ayn Rand Walk Into a",2018-04-16
TSLA,nytimes,Elon Musk Says SpaceX Rocket Launches Might Resume,2016-11-04
TSLA,nytimes,Elon Musk Is Cleared in Lawsuit Over His 'Pedo Guy' Tweet,2019-12-06
TSLA,nytimes,Elon Musk's Mars Vision: A One-Size-Fits-All Rocket. A,2017-09-28
TSLA,nytimes,Elon Musk Thinks a Mini-Submarine Could Help in Thai,2018-07-07
TSLA,nytimes,Elon Musk Likes It Here. Will Other Tech Innovators Follow?,2018-04-09
TSLA,nytimes,Elon Musk Walks Back 'Pedo Guy' Attack on Thai Cave Diver,2018-07-18
