ticker,site,headline,date
AAPL,nytimes,How Apple's Apps Topped Rivals in the App Store It Controls,2019-09-09
AAPL,nytimes,"After a Tax Crackdown, Apple Found a New Shelter for Its",2017-11-06
AAPL,nytimes,Apple Card Investigated After Gender Discrimination,2019-11-10
AAPL,nytimes,"Apple Event: Analysis of iPhone 6S, Apple TV and the Pencil",2015-09-09
AAPL,nytimes,Apple's Devices Lose Luster in American Classrooms,2017-03-02
AAPL,nytimes,What Is “Sign in with Apple” and Should I Use It? | Wirecutter,2019-09-23
AAPL,nytimes,Apple's iPhone 11 Has a New Feature: A Lower Price,2019-09-10
AAPL,nytimes,Apple's WWDC Highlights: the Death of iTunes and $6000,2019-06-03
AAPL,nytimes,Opinion | Why Apple Is the Future of Capitalism,2018-08-06
AAPL,nytimes,"Apple Piles On the Features, and Users Say, 'Enough!'",2017-06-02
AAPL,nytimes,Apple Opening Data Center in China to Comply With,2017-07-12
AAPL,nytimes,"Apple Watch Review: Bliss, but Only After a Steep Learning",2015-04-08
AAPL,nytimes,Taylor Swift Criticism Spurs Apple to Change Royalties Policy,2015-06-21
AAPL,nytimes,"Apple iPhone, Once a Status Symbol in China, Loses Its",2016-04-27
AAPL,nytimes,"Apple's Bad Month Is Getting Worse, Jeopardizing Its",2018-11-27
AAPL,nytimes,Apple Keeps Making Computer in Texas After Tariff Waivers,2019-09-23
AAPL,nytimes,U.S. Says It Has Unlocked iPhone Without Apple,2016-03-28
AAPL,nytimes,"At $1000, Apple's iPhone X Crosses a Pricing Threshold",2017-09-10
AAPL,nytimes,Apple Computers Used to Be Built in the U.S. It Was a Mess,2018-12-15
AAPL,nytimes,All the Ways Apple's iOS 11 Will Change Your iPhone,2017-06-12
AAPL,nytimes,Apple Watch Series 4 Review: A Big Step for Wearable,2018-09-19
AAPL,nytimes,How China Built 'iPhone City' With Billions in Perks,2016-12-29
AAPL,nytimes,Customers Waiting on New iPhones Crimp Apple's Profits,2017-05-02
AAPL,nytimes,"Apple, Citing U.S. Sanctions, Removes Popular Apps in Iran",2017-08-24
AAPL,nytimes,Apple Fights Order to Unlock San Bernardino Gunman's,2016-02-17
AAPL,nytimes,Why We Upgraded Our Reviews Approach for Apple's,2019-09-26
AAPL,nytimes,Why I'm Breaking Up With the Apple Watch,2015-06-10
AAPL,nytimes,When Eve and Eve Bit the Apple,2016-11-18
AAPL,nytimes,"The Long, Monstrous Reign of the Red Delicious Apple Is",2018-08-29
AAPL,nytimes,Opinion | The Incredible Shrinking Apple,2019-04-03
AAPL,nytimes,Apple Removes Apps From China Store That Help Internet,2017-07-29
AAPL,nytimes,Explaining Apple's Fight With the F.B.I,2016-02-17
AAPL,nytimes,"With a Revamped Apple TV, Company Hopes to Camp in",2015-09-04
AAPL,nytimes,Apple Goes to Hollywood. Will Its Story Have a Happy,2018-03-25
AAPL,nytimes,Apple's Tim Cook Barnstorms for 'Moral Responsibility',2017-08-28
AAPL,nytimes,Opinion | Apple Can't Resist Playing by China's Rules,2018-01-23
AAPL,nytimes,Apple Services Shut Down in China in Startling About-Face,2016-04-21
AAPL,nytimes,Apple Cracks Down on Apps That Fight iPhone Addiction,2019-04-27
AAPL,nytimes,Apple Sales Exceed Expectations as Buyers Wait for New,2017-08-01
AAPL,nytimes,Why Apple Is Right to Challenge an Order to Help the F.B.I,2016-02-18
AAPL,nytimes,Apple Unveils Video Service With Celebrity Parade but,2019-03-25
AAPL,nytimes,Apple News's Radical Approach: Humans Over Machines,2018-10-25
AAPL,nytimes,"Tekserve, Precursor to the Apple Store, to Close After 29",2016-06-29
AAPL,nytimes,Apple Shows Facebook Who Has the Power in an App,2019-01-31
AAPL,nytimes,"Accused of Slowing Old iPhones, Apple Offers Battery",2017-12-28
AAPL,nytimes,Apple's Value Hit $1 Trillion. Add Disney to Bank of,2018-08-02
AAPL,nytimes,Apple Disrupts Silicon Valley With Another Eye-Catcher,2017-07-04
AAPL,nytimes,"Apple Takes a Hit in China, and Workers There Feel the Pain",2019-02-01
AAPL,nytimes,Trump Escalates Feud With Apple and Threatens Tariffs on,2019-07-26
AAPL,nytimes,Hollywood Had Questions. Apple Didn't Answer Them,2019-03-26
AAPL,nytimes,The Best Investment Since 1926? Apple,2017-09-22
AAPL,nytimes,Media Companies Take a Big Gamble on Apple,2019-04-02
AAPL,nytimes,Apple Is the Most Valuable Public Company Ever. But How,2017-12-21
AAPL,nytimes,Goldman Sachs and Apple Plan to Offer a New Credit Card,2018-05-10
AAPL,nytimes,Breaking Down Apple's iPhone Fight With the U.S.,2016-03-21
AAPL,nytimes,Apple Backs Off Crackdown on Parental-Control Apps,2019-06-03
AAPL,nytimes,Apple Offers Free App to Teach Children Coding (iPads,2016-09-12
AAPL,nytimes,Apple and Qualcomm Settle All Disputes Worldwide,2019-04-16
AAPL,nytimes,Apple and Beats Developing Streaming Music Service,2015-03-25
AAPL,nytimes,The Things That Matter From Apple's September 2019,2019-09-10
AAPL,nytimes,"How, and Why, Apple Overtook Microsoft",2015-01-29
AAPL,nytimes,"Apple to Add $1 Billion Campus in Austin, Tex., in Broad",2018-12-13
AAPL,nytimes,Growing a Different Apple,2017-01-02
AAPL,nytimes,Apple Report Expects New iPhones to Jump-Start Growth,2017-11-02
AAPL,nytimes,Apple Unveils New iPad to Catch Google in the Classroom,2018-03-27
AAPL,nytimes,Apple Transforms Central Park Into an Augmented Reality,2019-08-09
AAPL,nytimes,Is Apple Saying Goodbye to Fashion?,2019-03-25
AAPL,nytimes,"Messages About iMessages, but Not From Apple",2017-01-30
AAPL,nytimes,Boston Red Sox Used Apple Watches to Steal Signs,2017-09-05
AAPL,nytimes,Apps Purged by Apple Say It Holds the Key They Need to,2019-05-30
AAPL,nytimes,Supreme Court Gives Samsung a Reprieve in Apple Patent,2016-12-06
AAPL,nytimes,Apple Won't Always Rule. Just Look at IBM,2015-04-25
AAPL,nytimes,Apple TV Plus Is Just $5. Will People Pay for It?,2019-09-11
AAPL,nytimes,It's Time for Apple to Build a Less Addictive iPhone,2018-01-17
AAPL,nytimes,Apple Announces $1 Billion Fund to Create U.S. Jobs in,2017-05-03
AAPL,nytimes,Justice Department Calls Apple's Refusal to Unlock iPhone,2016-02-19
AAPL,nytimes,Is Apple Slowing Down Old iPhones? Questions and,2017-12-21
AAPL,nytimes,Apple Scales Back Its Ambitions for a Self-Driving Car,2017-08-22
AAPL,nytimes,Inside Apple's Earthquake-Ready Headquarters,2019-06-04
AAPL,nytimes,Apple Music: Platform? Promoter? Both,2016-12-22
AAPL,nytimes,New Paid Apple News Service Said to Feature Wall Street,2019-03-20
AAPL,nytimes,Apple's WWDC 2018 Live: Apple Still Wants to Be Different,2018-06-04
AAPL,nytimes,Apple's Stance Highlights a More Confrontational Tech,2016-02-17
AAPL,nytimes,Warren Buffett Stake Suggests Apple Is All Grown Up,2016-05-19
AAPL,nytimes,"At the Apple Keynote, Selling Us a Better Vision of Ourselves",2017-09-12
AAPL,nytimes,Why Netflix Won't Be Part of Apple TV,2019-03-22
AAPL,nytimes,"Apple AirPods Review: Perfect Earbuds, but They Don't Last",2019-04-03
AAPL,nytimes,"Fire Blight Spreads Northward, Threatening Apple Orchards",2019-12-04
AAPL,nytimes,"Apple Developer Conference: A More Open Siri, and Other",2016-06-13
AAPL,nytimes,"Podcasts Surge, but Producers Fear Apple Isn't Listening",2016-05-07
AAPL,nytimes,Apple Pay Violates Patents Held by Security Technology,2017-05-21
AAPL,nytimes,An Oregon Mill Town Learns to Love Facebook and Apple,2018-03-06
AAPL,nytimes,Apple Music and Labels Investigated in 2 States,2015-06-09
AAPL,nytimes,"Apple Unveils Bigger iPhones at Higher Prices, and a",2018-09-12
AAPL,nytimes,"IPhone 7 Review: Though Not Perfect, New iPhones Keep",2016-09-13
AAPL,nytimes,"Apple Becomes a Green Energy Supplier, With Itself as",2016-08-23
AAPL,nytimes,What Is Apple AirPlay 2? | Wirecutter,2018-07-18
AAPL,nytimes,Apple's $1 Trillion Milestone Reflects Rise of Powerful,2018-08-02
AAPL,nytimes,Apple TV Remote Expected to Add Touch Pad in Redesign,2015-05-04
AAPL,nytimes,Apple and Justice Dept. Trade Barbs in iPhone Privacy Case,2016-03-15
AAPL,nytimes,"Apple Still Holds the Keys to Its Cloud Service, but",2016-02-21
AAPL,nytimes,"Apple's Earnings Surge, as iPhone Sales Jump and China",2015-04-27
AAPL,nytimes,Apple's Corporate Responsibility for Distracted Driving,2017-01-11
AAPL,nytimes,"Apple Is Worth $1000000000000. Two Decades Ago, It",2018-08-02
AAPL,nytimes,Apple TV Plus: More Than 'The Morning Show',2019-10-31
AAPL,nytimes,Trump's Bizarre Apple Factory Visit,2019-11-21
AAPL,nytimes,Is the Apple Watch LTE the dumb phone you've been,2018-04-17
AAPL,nytimes,Telegram App Says Apple Is Blocking Updates Over,2018-05-31
AAPL,nytimes,When Apple Maps Marks Your Spot,2017-05-08
AAPL,nytimes,The Jamaican Apple Pickers of Upstate New York,2017-10-05
AAPL,nytimes,I Used Apple's New Controls to Limit a Teenager's iPhone,2018-07-11
AAPL,nytimes,Opinion | You Should Have the Right to Sue Apple,2018-12-12
AAPL,nytimes,The Fabulous Apple Cash Machine,2017-05-05
AAPL,nytimes,"IPhone Sales Drop, and Apple's 13-Year Surge Ebbs",2016-04-26
AAPL,nytimes,Can the Big Apple Circus Be Saved?,2016-06-03
AAPL,nytimes,"Apple Said to Plan Limited, Low-Cost Streaming Service",2015-03-17
AAPL,nytimes,"Once Taunted by Steve Jobs, Companies Are Now Big",2016-08-07
AAPL,nytimes,Spotify Accuses Apple of Anticompetitive Practices in Europe,2019-03-13
AAPL,nytimes,Apple vs. the F.B.I.: How the Case Could Play Out,2016-03-20
AAPL,nytimes,Samsung's Patent Loss to Apple Is Appealed to Supreme,2015-12-14
AAPL,nytimes,"Apple Owes $14.5 Billion in Back Taxes to Ireland, E.U. Says",2016-08-30
AAPL,nytimes,Apple's First Foray Into Original TV Is a Series About Apps,2016-03-24
AAPL,nytimes,A World War II Apple Stages a Comeback,2019-08-05
AAPL,nytimes,U.S. Says It May Not Need Apple's Help to Unlock iPhone,2016-03-21
AAPL,nytimes,Readers Ask About Apple's New iPhone and Watch,2016-09-13
AAPL,nytimes,Apple Stock Reacts After Tim Cook Email Praises China,2015-08-24
AAPL,nytimes,Apple's Silence in China Sets a Dangerous Precedent,2017-07-31
AAPL,nytimes,"With a Tap of Taylor Swift's Fingers, Apple Retreated",2015-06-22
AAPL,nytimes,"Forget the New iPhone. For Apple, It's All About the Dollar",2016-03-26
AAPL,nytimes,The Apple Watch: More Than Just a Bracelet,2015-05-05
AAPL,nytimes,"Apple's New Emojis: Dinosaurs, Dumplings and 'ILY'",2017-10-06
AAPL,nytimes,Chance the Rapper Says His Apple Music Deal Was Worth,2017-03-17
AAPL,nytimes,Apple Hires Google's A.I. Chief,2018-04-03
AAPL,nytimes,How Apple TV Stacks Up: A Rundown of Streaming Devices,2015-10-28
AAPL,nytimes,What You Need to Know About Apple's Spring 2016 Event,2016-03-21
AAPL,nytimes,Apple and Nokia Battle Over Cellphone Patents,2016-12-22
AAPL,nytimes,"Apple Music Is Strong on Design, Weak on Social Networking",2015-07-01
AAPL,nytimes,"Apple, in Seeming Jab at Spotify, Proposes Simpler",2016-07-15
AAPL,nytimes,"Apple, Moving In on Prestige TV, Poaches Two Sony",2017-06-16
AAPL,nytimes,"Skype Vanishes From App Stores in China, Including Apple's",2017-11-21
AAPL,nytimes,Review: Apple's 'Morning Show'? Wait for the Upgrade,2019-10-31
AAPL,nytimes,Apple Could Soon Be Worth $1 Trillion as Profits Pour In,2018-07-31
AAPL,nytimes,California Today: What We Learned at Apple's iPhone,2018-09-13
AAPL,nytimes,"Apple Pulls Samuel L. Jackson Movie From Festival, Citing",2019-11-20
AAPL,nytimes,Apple Watch: A Test Run for Travelers,2015-05-05
AAPL,nytimes,"Zane Lowe, the D.J. Scratching Out Beats 1 for Apple",2015-06-25
AAPL,nytimes,Apple TV Plus and Disney Plus: What Shows Are Worth,2019-11-19
AAPL,nytimes,What You Need to Know About Apple's WWDC 2016 Event,2016-06-13
AAPL,nytimes,Review: 'Becoming Steve Jobs' Focuses on Another Apple,2015-03-25
AAPL,nytimes,Stocks Dive After Apple Supplier Slashes Outlook,2018-11-12
AAPL,nytimes,"Amazon Hits $1000000000000 in Value, Following Apple",2018-09-04
AAPL,nytimes,Apple and Oprah Winfrey Sign a Content Deal,2018-06-15
AAPL,nytimes,"Tiananmen Square, Apple, Elaine Chao: Your Tuesday",2019-06-03
AAPL,nytimes,The Secret to a Really Crisp Apple,2017-03-03
AAPL,nytimes,Apple Adds Another Show to Its Growing Streaming Stable,2017-12-15
AAPL,nytimes,"Apple Encryption Engineers, if Ordered to Unlock iPhone,",2016-03-17
AAPL,nytimes,Jury Awards Apple $539 Million in Samsung Patent Case,2018-05-24
AAPL,nytimes,"Apple Watch Series 3 Excels, Even if You Don't Need",2017-09-20
AAPL,nytimes,Affairs of the Wrist: The Apple Watch Comes Between Them,2015-06-11
AAPL,nytimes,"Apple Opens the iMessage Door, and the Ephemera",2016-09-22
AAPL,nytimes,Apple's New MacBook Pro Gets More Touchy,2016-10-27
AAPL,nytimes,Tech Backlash Grows as Investors Press Apple to Act on,2018-01-08
AAPL,nytimes,"Apple Goes to Court, and F.B.I. Presses Congress to Settle",2016-02-25
AAPL,nytimes,Apple to Offer App Developers Access to Siri and iMessage,2016-06-13
AAPL,nytimes,Apple Will Stop Revealing How Many iPhones It Sells.,2018-11-02
AAPL,nytimes,"In a Stumble for Apple, a FaceTime Bug Lets iPhone Users",2019-01-28
AAPL,nytimes,"Why Apple Scrapped the Release of Its Oscar Contender, '",2019-12-06
AAPL,nytimes,Google and Apple: the High-Tech Hippies of Silicon Valley,2016-03-28
AAPL,nytimes,Review: A Game Effort at Polishing Up 'The Golden Apple',2017-05-11
AAPL,nytimes,Apple to Ban Vaping Apps From Its Store,2019-11-17
AAPL,nytimes,Apple Steps Into the Movie Business,2019-09-27
AAPL,nytimes,How Apple Thrived in a Season of Tech Scandals,2018-09-26
AAPL,nytimes,Qualcomm Accuses Apple of Stealing Secrets to Help Intel,2018-09-25
AAPL,nytimes,Giants Suspend Eli Apple After Teammate's 'Cancer',2017-12-27
AAPL,nytimes,Apple Shareholders Show Their Support for Tim Cook,2016-02-26
AAPL,nytimes,"Apple's New MacBook Pro: Fast and Light, but Not for",2016-11-14
AAPL,nytimes,Apple's New Job: Selling a Smartwatch to an Uninterested,2015-02-27
AAPL,nytimes,Opinion | Why Does Apple Control Its Competitors?,2019-05-02
AAPL,nytimes,More Fun on Your Wrist With New Apps for the Apple Watch,2016-09-28
AAPL,nytimes,Opinion | Apple's Emoji Gun Control,2016-08-16
AAPL,nytimes,India Extends Hand to Apple and Others by Easing Rules,2018-01-10
AAPL,nytimes,Mark Zuckerberg Backs Apple in Its Refusal to Unlock iPhone,2016-02-22
AAPL,nytimes,"Apple Said to Be Acquiring Shazam, the Song Identifying App",2017-12-08
AAPL,nytimes,"Richard Plepler, Former HBO Boss, Is Close to Apple Deal",2019-11-12
AAPL,nytimes,"Google Buying Apple? Sorry, That Was Just a Test",2017-10-10
AAPL,nytimes,Apple Enters Show Business With a Black-Carpet Premiere,2019-10-30
AAPL,nytimes,Apple Apologizes to Black Students Ejected From Store in,2015-11-12
AAPL,nytimes,16 Useful Gems in Apple's New iOS 13,2019-10-27
AAPL,nytimes,Thawing a Frozen Apple TV App,2018-02-06
AAPL,nytimes,Apple Is Said to Be Trying to Make It Harder to Hack iPhones,2016-02-24
AAPL,nytimes,Amazon and Apple Gush Over Holiday Sales,2018-02-01
AAPL,nytimes,Inside The Times's Apple Watch News App,2015-05-27
AAPL,nytimes,That New Apple Watch EKG Feature? There Are More,2018-10-08
AAPL,nytimes,What You Need to Know About Apple's Software Upgrades,2016-06-13
AAPL,nytimes,Apple Cuts Revenue Forecast Because of Slow iPhone,2019-01-02
AAPL,nytimes,Chinese Court Says Apple Infringed on Qualcomm Patents,2018-12-10
AAPL,nytimes,Alex Jones's Infowars Is Removed From Apple's App Store,2018-09-07
AAPL,nytimes,Apple's Reach Reshapes Medical Research,2019-11-14
AAPL,nytimes,Apple and Samsung End Smartphone Patent Wars,2018-06-27
AAPL,nytimes,Apple Kuchen for a Sweet Jewish New Year,2015-09-04
AAPL,nytimes,Apple Music Makes Debut With D.J. Carrying the Flag,2015-06-30
AAPL,nytimes,Apple Is Forming an Auto Team,2015-02-19
AAPL,nytimes,"Review: Steve Jobs of Apple, Tech Visionary, Has Glitches",2017-07-23
AAPL,nytimes,Chief of Apple Stores Is Leaving After 5 Years in the Job,2019-02-05
AAPL,nytimes,Apple Says It Has Fixed FaceTime Security Bug,2019-02-01
AAPL,nytimes,"Jony Ive, Designer Who Made Apple Look Like",2019-06-27
AAPL,nytimes,'Pear-Shaped' May Be Healthier Than 'Apple-Shaped',2019-06-30
AAPL,nytimes,Test Driving Apple's iOS 9,2015-09-09
AAPL,nytimes,Bill Gates Weighs In on Apple's Clash With the F.B.I,2016-02-23
AAPL,nytimes,The New Apple TV Invigorates the Set-Top Box,2015-10-28
AAPL,nytimes,"Siri, Apple Music and Other iPhone Questions",2015-09-22
AAPL,nytimes,"Apple Shifts From Genius Bars to Genius Groves, Hoping",2016-05-19
AAPL,nytimes,Apple Faces Inquiry in China Over App Store Content,2017-04-19
AAPL,nytimes,Behind Apple's 'Slow-Roll' Marketing Push for Its New,2019-11-01
AAPL,nytimes,Beyond the Honeycrisp Apple,2015-11-03
AAPL,nytimes,Ireland to Appeal Tax Ruling in Apple Case,2016-09-02
AAPL,nytimes,Microsoft Is Worth as Much as Apple. How Did That Happen?,2018-11-29
AAPL,nytimes,Apple to Close iPhone Security Hole That Law,2018-06-13
AAPL,nytimes,Video Feature: Playing to the Strengths of the New Apple TV,2015-11-11
AAPL,nytimes,Apple Unveils iPhone X and 8 Models as It Upgrades TV,2017-09-12
AAPL,nytimes,A Brief Explanation of Apple's Showdown With the U.S.,2016-02-26
AAPL,nytimes,They Bonded Over Caramel Apple Pie,2019-06-08
AAPL,nytimes,"Apple Watch Displays Your Digital World, at a Glance",2015-03-09
AAPL,nytimes,"Pearl Automation, Founded by Apple Veterans, Shuts Down",2017-06-26
AAPL,nytimes,Dear Diary: My Week Wearing an Apple Watch,2015-04-08
AAPL,nytimes,Apple to Manufacture New Mac Pro Computer in China,2019-06-28
AAPL,nytimes,"They Tried to Boycott Facebook, Apple and Google.",2018-04-01
AAPL,nytimes,Apple's iPhone 7 and Watch Updates: What You Really,2016-09-07
AAPL,nytimes,Apple Was Slow to Act on FaceTime Bug That Allows,2019-01-29
AAPL,nytimes,Apple's HomePod Has Arrived. Don't Rush to Buy It,2018-02-06
AAPL,nytimes,"Drake Announces 'More Life' on His Preferred Platform,",2016-10-24
AAPL,nytimes,Apple Gives Corning $200 Million to Invent Better Phone,2017-05-12
AAPL,nytimes,Hands-On Experience With Apple's New Devices,2015-09-09
AAPL,nytimes,"Apple Music Is Unveiled, Along With Operating System",2015-06-08
AAPL,nytimes,Apple Shuns the Tech Industry's Apology Tour,2018-06-04
AAPL,nytimes,"Apple, in Sign of Health Ambitions, Adds Medical Records",2018-01-24
AAPL,nytimes,Qualcomm Pegs Payment From Apple at $4.5 Billion to,2019-05-01
AAPL,nytimes,Narrow Focus May Aid F.B.I. in Apple Case,2016-02-22
AAPL,nytimes,Apple's iPhone Keeps Going Its Own Way,2015-09-09
AAPL,nytimes,Scheme to Swap Fake iPhones Adds Up to $900000 Loss,2019-04-06
AAPL,nytimes,Apple Takes On a Market Full of Streaming Services,2015-06-03
AAPL,nytimes,Video Feature: Apple Watch Apps That Are Available Now,2015-06-17
AAPL,nytimes,Find Out What Apple's New iPhones and iOS Can Do,2015-09-23
AAPL,nytimes,25 Apple Dessert Recipes Our Readers Love,2019-09-28
AAPL,nytimes,"To Woo Apple, Foxconn Bets $3.5 Billion on Sharp",2016-03-30
AAPL,nytimes,"Guatemala, North Korea, Apple: Your Monday Evening",2018-06-04
AAPL,nytimes,A Grab Bag of Software for the Apple Watch Upgrade,2015-09-30
AAPL,nytimes,"Changing Tactics, Apple Promotes Watch as a Luxury Item",2015-04-19
AAPL,nytimes,Apple Watch Success Will Hinge on Apps,2015-03-09
AAPL,nytimes,Apple Used to Know Exactly What People Wanted,2018-10-03
AAPL,nytimes,Apple Starts to Woo Its App Developers,2016-06-10
AAPL,nytimes,Apple iPhone XR Review: A Cheaper Phone Suited to,2018-10-23
AAPL,nytimes,Apple's Privacy Fight Tests Relationship With White House,2016-02-26
AAPL,nytimes,15-Year-Old's 200 Vintage Apple Computers Are Now a,2016-05-09
AAPL,nytimes,Apple AirPods Pro Review: The 'Hearable' at Its Best,2019-12-12
AAPL,nytimes,Apple Wins Ruling in New York iPhone Hacking Order,2016-02-29
AAPL,nytimes,The iPhone Is 10 Years Old. Here's the Story of Its Birth,2017-06-19
AAPL,nytimes,The iPhone X Is Cool. That Doesn't Mean You Are Ready,2017-11-01
AAPL,nytimes,Dear iPhone: Here's Why We're Still Together After 10 Years,2017-08-23
AAPL,nytimes,How to Sell Your Old iPhone | Wirecutter,2018-09-10
AAPL,nytimes,The iPhone X Arrives Friday. Here's What You Need to Know,2017-10-30
AAPL,nytimes,How Has the iPhone Affected Your Life?,2017-09-13
AAPL,nytimes,The iPhone 8: A Worthy Refinement Before the Next,2017-09-19
AAPL,nytimes,The Times Review of the First iPhone: 'Amazing' but 'Not,2017-09-12
AAPL,nytimes,"An iPhone's Journey, From the Factory Floor to the Retail",2016-12-29
AAPL,nytimes,"Why You May Want a Smaller iPhone, and Your Questions",2016-03-23
AAPL,nytimes,Your iPhone Is Ruining Your Posture — and Your Mood,2015-12-12
AAPL,nytimes,The iPhone 8 Reviews: What the Critics Say,2017-09-19
AAPL,nytimes,How to Turn an iPhone Into a Work-Only Tool,2019-08-21
AAPL,nytimes,How to Never Lose Your iPhone Headphone Adapter Again,2018-04-12
AAPL,nytimes,All the New Gestures You're About to Learn on the iPhone X,2017-12-26
AAPL,nytimes,What Pricing Plan to Get for an iPhone 6,2015-09-02
AAPL,nytimes,The iPhone XS and XS Max Review: Big Screens That Are,2018-09-18
AAPL,nytimes,"Apple Unveils iPhone 6S, and Breaks Own Taboos With",2015-09-09
AAPL,nytimes,Opinion | It's Your iPhone. Why Can't You Fix It Yourself?,2019-04-06
AAPL,nytimes,"In China, an iPhone May Not Necessarily Be a Phone",2016-05-04
AAPL,nytimes,Locked Out of Your iPhone? Here's What to Do,2018-06-22
AAPL,nytimes,How to Record Your iPhone Screen,2018-05-16
AAPL,nytimes,You Took Lousy iPhone Photos. Here's How to Make Them,2018-08-29
AAPL,nytimes,"Sean Baker Talks 'Tangerine,' and Making a Movie With an",2015-07-05
AAPL,nytimes,IPhone Users Urged to Update Software After Security,2016-08-25
AAPL,nytimes,When the iPhone Disturbs You About Driving,2017-11-02
AAPL,nytimes,"iPhone, Take a Message",2017-01-18
AAPL,nytimes,How to Stop Waking Up the iPhone,2017-10-27
AAPL,nytimes,When Is a Lease Not a Lease? When It's an iPhone,2015-09-18
AAPL,nytimes,Your Next iPhone Might Be Made in Vietnam. Thank the,2019-07-30
AAPL,nytimes,Keeping Your iPhone Out of the Drop Zone,2017-06-27
AAPL,nytimes,Your iPhone Slowed Down. Here's What to Do When,2018-01-31
AAPL,nytimes,Chrome's Glass Ceiling on an iPhone,2018-07-16
AAPL,nytimes,Put Your iPhone Photos on the Map,2016-09-22
AAPL,nytimes,El viaje de un iPhone desde la fábrica hasta la tienda,2017-01-02
AAPL,nytimes,Testing iPhone 6s's 3D Touch and Live Photos Features,2015-09-22
AAPL,nytimes,Step-by-Step Fitness History on an iPhone,2016-03-03
AAPL,nytimes,Opening .Zip Files on an iPhone,2015-12-18
AAPL,nytimes,How to Switch to iPhone From Android: Patience and,2016-04-06
AAPL,nytimes,Adding More Fingerprints to iPhone Sensors,2016-05-10
AAPL,nytimes,Reviving a Sluggish iPhone,2016-05-25
AAPL,nytimes,How a Pro Photographer Edits iPhone Photos | Wirecutter,2019-06-26
AAPL,nytimes,Copying iPhone Messages to the Computer,2018-01-01
AAPL,nytimes,Should the Authorities Be Able to Access Your iPhone?,2016-02-17
AAPL,nytimes,It's 1468. Why Does the Village Priest Have an iPhone?,2019-11-19
AAPL,nytimes,Here Come the iPhone 7 and iOS 10 Apps: What to Try First,2016-09-21
AAPL,nytimes,F.B.I. Director Suggests Bill for iPhone Hacking Topped,2016-04-21
AAPL,nytimes,What Happens If Your iPhone or Other Smartphone Has,2016-08-25
AAPL,nytimes,Add International Keyboards on an iPhone,2017-11-08
AAPL,nytimes,F.B.I. Used Hacking Software Decade Before iPhone Fight,2016-04-13
AAPL,nytimes,Turkish President Calls for Boycott of U.S. Electronics,2018-08-14
AAPL,nytimes,Leaving New Fingerprints on the iPhone,2017-03-28
AAPL,nytimes,Recording 4K Video on an iPhone,2018-02-01
AAPL,nytimes,Use the iPhone's Sleep Diary,2018-06-27
AAPL,nytimes,Punting iPhone Calls to Voice Mail,2017-11-29
AAPL,nytimes,"Freed From the iPhone, the Apple Watch Finds a Medical",2017-12-26
AAPL,nytimes,Slowing iPhone Battery Drain,2017-11-06
AAPL,nytimes,Turner Prize Goes to Charlotte Prodger for Films Shot on,2018-12-04
AAPL,nytimes,El iPhone X es extraordinario… quizá demasiado,2017-11-02
AAPL,nytimes,Bringing Up Baby -- on the iPhone - Room for Debate,2015-04-13
AAPL,nytimes,Repurposing an Old iPhone,2015-04-27
AAPL,nytimes,Getting Those Giant Video Clips Off Your iPhone,2018-01-25
AAPL,nytimes,"How Tim Cook, in iPhone Battle, Became a Bulwark for",2016-02-18
AAPL,nytimes,Wirecutter Weekly: How to charge your iPhone twice as fast,2019-03-11
AAPL,nytimes,Taking Someone Off Your iPhone's Blocked List,2016-03-23
AAPL,nytimes,How to Save iPhone Voice Mail Messages,2017-02-07
AAPL,nytimes,"Beware, iPhone Users: Fake Retail Apps Are Surging",2016-11-06
AAPL,nytimes,Apps for Meditation and Calming on iPhone and Android,2015-02-25
AAPL,nytimes,The Man Who Made Your iPhone Wants to Run Taiwan. A,2019-04-17
AAPL,nytimes,"Your Weekend Briefing: Donald Trump, Hillary Clinton,",2016-02-28
AAPL,nytimes,Steve Jobs nunca quiso que fueras adicto a tu iPhone,2019-01-30
AAPL,nytimes,"Gracias a la guerra comercial, tu próximo iPhone podría",2019-08-05
AAPL,nytimes,Stopping the iPhone Step Counter,2015-08-12
AAPL,nytimes,"The Easy, Belated Way to Add a Headphone Jack to Your",2018-03-29
AAPL,nytimes,El iPhone ha cambiado al mundo pero no tanto como la,2017-07-11
AAPL,nytimes,Apple vs. el FBI: la importancia del conflicto por,2016-02-18
AAPL,nytimes,Apple's New Challenge: Learning How the U.S. Cracked Its,2016-03-29
AAPL,nytimes,¿Apple vuelve lentos los modelos antiguos de iPhone,2017-12-27
AAPL,nytimes,Llegó el momento de que Apple fabrique un iPhone menos,2018-01-19
AAPL,nytimes,"Reseña: iPhone XR, un teléfono para la mayoría de",2018-10-25
AAPL,nytimes,Putting Faces to Names in the iPhone Contacts App,2016-04-18
AAPL,nytimes,"With iPhone and Stickers, a Doodling Artist Who Dreams Big",2017-08-01
AAPL,nytimes,"Las novedades de Apple: iPhone X, iPhone 8, 8s y",2017-09-12
AAPL,nytimes,Aprende a mejorar las fotos que tomas con un iPhone,2018-09-03
AAPL,nytimes,Apple elimina algunas aplicaciones que combaten la,2019-05-06
AAPL,nytimes,La historia (aún) secreta del nacimiento del iPhone,2017-06-22
AAPL,nytimes,How an Abuse Victim's Nerve and a Hidden iPhone Led to,2019-04-28
AAPL,nytimes,Steve Jobs Never Wanted Us to Use Our iPhones Like This,2019-01-25
AAPL,nytimes,Opinion | Aaron Sorkin's 'Steve Jobs' Con,2015-10-13
AAPL,nytimes,"Different Thinking About Steve Jobs, the Man Behind Apple",2015-09-03
AAPL,nytimes,What Steve Jobs Taught Me About Being a Son and a Father,2015-08-07
