ticker,site,headline,date
AAPL,nytimes,"'Steve Jobs' Flops at Box Office, and Silicon Valley Cheers",2015-12-02
AAPL,nytimes,Below the Line: Scoring 'Steve Jobs',2015-12-02
AAPL,nytimes,5 Reasons You Wouldn't Want to Be in Tim Cook's Shoes,2019-01-04
AAPL,nytimes,What I Learned from Watching My iPad's Slow Death,2018-02-06
AAPL,nytimes,"New iPad Pro Inches Toward Replacing PC, but Falls Short",2017-06-12
AAPL,nytimes,Picking an iPad as a Portable Photo Studio,2018-07-25
AAPL,nytimes,Connecting Hardware to an iPad,2018-03-20
AAPL,nytimes,Ditching Pop-Up Ads and Scareware Alerts on the iPad,2017-04-06
AAPL,nytimes,Using the New iPad Apps Dock,2017-10-03
AAPL,nytimes,Flicks and Other iPad Keyboard Tricks,2018-07-18
AAPL,nytimes,Managing an iPad's Battery Use,2018-01-22
AAPL,nytimes,"For Some, iPad Pro Can't Match PC Strengths",2016-03-02
AAPL,nytimes,Freeing Lonely iPad Apps From Almost Empty Folders,2016-04-12
AAPL,nytimes,Adding Art to iPad Documents,2018-05-08
AAPL,nytimes,Adding Fonts to an iPad,2018-04-26
AAPL,nytimes,An iPad Misplaced at the Airport Takes Its Own Vacation,2016-05-01
AAPL,nytimes,Finding Your iPad Backup Files,2017-08-18
AAPL,nytimes,Choosing an iPad Pro Keyboard,2015-12-09
AAPL,nytimes,Introducing the Next New York Times iPad App,2017-09-09
AAPL,nytimes,Taking Your Data Plan to a New iPad,2017-08-11
AAPL,nytimes,Adding Gmail Contacts to an iPad,2018-01-10
AAPL,nytimes,Loading the Kindle Library on an iPad,2016-02-23
AAPL,nytimes,Moving PDFs to a PC From an iPad,2016-04-21
AAPL,nytimes,David Hockney Paints Yosemite — on an iPad,2016-05-02
AAPL,nytimes,Editing RAW Images on an iPad,2018-04-12
AAPL,nytimes,Have a Group Chat on an iPad,2017-10-12
AAPL,nytimes,Moving CD-Ripped Music From the Computer to the iPad,2016-04-01
AAPL,nytimes,Turn an iPad-Made Movie Into a DVD,2016-11-17
AAPL,nytimes,Can You Run Android on an iPad?,2017-09-27
AAPL,nytimes,Find the Right Power Cord for Your MacBook,2017-01-27
AMZN,nytimes,Inside Amazon: Wrestling Big Ideas in a Bruising Workplace,2015-08-15
AMZN,nytimes,Prime Power: How Amazon Squeezes the Businesses,2019-12-19
AMZN,nytimes,"As Amazon Pushes Forward With Robots, Workers Find",2017-09-10
AMZN,nytimes,Opinion | Hate Amazon? Try Living Without It,2018-12-08
AMZN,nytimes,Amazon Is Pushing Facial Technology That a Study Says,2019-01-24
AMZN,nytimes,Amazon to Buy Whole Foods for $13.4 Billion,2017-06-16
AMZN,nytimes,How Amazon Steers Shoppers to Its Own Products,2018-06-23
AMZN,nytimes,"Inside Amazon Go, a Store of the Future",2018-01-21
AMZN,nytimes,Opinion | Amazon Bites Off Even More Monopoly Power,2017-06-21
AMZN,nytimes,"Dear Amazon, We Picked Your New Headquarters for You",2017-09-09
AMZN,nytimes,Over 4200 Amazon Workers Push for Climate Change,2019-04-10
AMZN,nytimes,Amazon Is Latest Tech Giant to Face Staff Backlash Over,2018-06-22
AMZN,nytimes,Amazon Knows What You Buy. And It's Building a Big Ad,2019-01-20
AMZN,nytimes,Amazon to Raise Minimum Wage to $15 for All U.S. Workers,2018-10-02
AMZN,nytimes,I Found Work on an Amazon Website. I Made 97 Cents,2019-11-15
AMZN,nytimes,Opinion | New York Should Say No to Amazon,2018-11-09
AMZN,nytimes,Prime Leverage: How Amazon Wields Power in,2019-12-15
AMZN,nytimes,"In Superstar Cities, the Rich Get Richer, and They Get",2018-11-07
AMZN,nytimes,Activists Build a Grass-Roots Alliance Against Amazon,2019-11-26
AMZN,nytimes,Amazon Will Let Customers Try On Clothes Before Buying,2017-06-20
AMZN,nytimes,"Trump Attacks Amazon, Saying It Does Not Pay Enough",2018-03-29
AMZN,nytimes,Think Amazon's Drone Delivery Idea Is a Gimmick?,2016-08-10
AMZN,nytimes,The Hidden Player Spurring a Wave of Cheap Consumer,2017-12-06
AMZN,nytimes,Let's Talk About Amazon Reviews: How We Spot the Fakes,2016-05-13
AMZN,nytimes,Amazon Is Quietly Eliminating List Prices,2016-07-03
AMZN,nytimes,Opinion | Is Amazon Bad for America?,2018-11-15
AMZN,nytimes,Opinion | How Sears Was the Amazon of Its Day,2018-10-15
AMZN,nytimes,Amazon Dominates as a Merchant and Platform. Europe,2018-09-19
AMZN,nytimes,"Inside an Amazon Warehouse, Robots' Ways Rub Off on",2019-07-03
AMZN,nytimes,"The Amazon Coat, One Year Later",2019-11-27
AMZN,nytimes,Will Amazon Ruin or Revitalize New York City?,2018-11-21
AMZN,nytimes,A $2 Billion Question: Did New York and Virginia Overpay,2018-11-13
AMZN,nytimes,Amazon's Latest Experiment: Retraining Its Work Force,2019-07-11
AMZN,nytimes,Amazon Sets Up Shop in the Heart of the Publishing Industry,2017-05-24
AMZN,nytimes,How to Save the Amazon Without Condescending to Brazil,2019-08-26
AMZN,nytimes,Amazon Challenges Etsy With Strictly Handmade,2015-10-08
AMZN,nytimes,Detailing Amazon's Custom-Clothing Patent,2017-05-01
AMZN,nytimes,Amazon Gives Up on Chinese Domestic Shopping Business,2019-04-18
AMZN,nytimes,Amazon Is Getting at Least $1.7 Billion to Come to Queens.,2018-11-13
AMZN,nytimes,"Amazon Reports Unexpected Profit, and Stock Soars",2015-07-23
AMZN,nytimes,Why the Amazon Deal Collapsed: A Tech Giant Stumbles,2019-02-15
AMZN,nytimes,"Amazon Deforestation, Once Tamed, Comes Roaring Back",2017-02-24
AMZN,nytimes,"Jeff Bezos, Mr. Amazon, Steps Out",2018-01-12
AMZN,nytimes,"Amazon Wants to Rule the Grocery Aisles, and Not Just at",2019-07-28
AMZN,nytimes,"Attention, Amazon Shoppers: Google Wants Some of Your",2019-05-14
AMZN,nytimes,Opinion | New York Returns 25000 Jobs to Amazon,2019-02-14
AMZN,nytimes,A.I. Experts Question Amazon's Facial-Recognition,2019-04-03
AMZN,nytimes,"Newark Says, Hey Amazon, Look Over Here",2017-10-16
AMZN,nytimes,"If Workers Slack Off, the Wristband Will Know. (And",2018-02-01
AMZN,nytimes,Amazon's Move Signals End of Line for Many Cashiers,2017-06-17
AMZN,nytimes,"When Sears Flourished, So Did Workers. At Amazon, It's",2018-10-23
AMZN,nytimes,Somali Workers in Minnesota Force Amazon to Negotiate,2018-11-20
AMZN,nytimes,Opinion | Parnassus Books Cares About Us. Does Amazon?,2019-08-26
AMZN,nytimes,Google and Walmart Partner With Eye on Amazon,2017-08-23
AMZN,nytimes,Opinion | New York City Needs Amazon as Much as,2018-11-16
AMZN,nytimes,Amazon's Wage Increase Comes Down to Cost vs. Political,2018-10-02
AMZN,nytimes,Amazon Uses a Twitter Army of Employees to Fight,2019-08-15
AMZN,nytimes,India Curbs Power of Amazon and Walmart to Sell,2018-12-26
AMZN,nytimes,Airline Used by Amazon Wins Order to End Cargo Pilots',2016-11-23
AMZN,nytimes,"20 Years On, Amazon and Jeff Bezos Prove Naysayers",2017-05-15
AMZN,nytimes,Amazon's Alexa Never Stops Listening to You | Wirecutter,2019-08-08
AMZN,nytimes,Microsoft Wins Pentagon's $10 Billion JEDI Contract,2019-10-26
AMZN,nytimes,"Amazon Proves Infertile Soil for Unions, So Far",2016-05-16
AMZN,nytimes,Amazon's Latest Way Into Your Life Is Through the Front Door,2017-10-25
AMZN,nytimes,Thousands Once Spoke His Language in the Amazon.,2017-12-26
AMZN,nytimes,Delivering Amazon Packages to the Top of the World,2018-07-02
AMZN,nytimes,Amazon Chooses 20 Finalists for Second Headquarters,2018-01-18
AMZN,nytimes,The Amazon Warehouse Comes to SoHo,2018-11-28
AMZN,nytimes,How Alexa Fits Into Amazon's Prime Directive,2017-01-24
AMZN,nytimes,Booksellers Protest Amazon Site's Move to Drop Stores,2018-11-04
AMZN,nytimes,What Happens After Amazon's Domination Is Complete? Its,2019-06-23
AMZN,nytimes,Amazon's Profit Falls Sharply as Company Buys Growth,2019-10-24
AMZN,nytimes,Profitable Giants Like Amazon Pay $0 in Corporate Taxes.,2019-04-29
AMZN,nytimes,"Amazon Hits $1000000000000 in Value, Following Apple",2018-09-04
AMZN,nytimes,Bolsonaro Wants to Plunder the Amazon. Don't Let Him,2019-01-29
AMZN,nytimes,"Amazon Went to City Hall. Things Got Loud, Quickly",2018-12-12
AMZN,nytimes,Amazon and Union at Odds Over Firing of Staten Island,2019-03-20
AMZN,nytimes,Amazon Leans on Government in Its Quest to Be a Delivery,2016-03-20
AMZN,nytimes,A Trip Through Amazon's First Physical Store,2016-03-10
AMZN,nytimes,"Before a Deal, Amazon Had to Know: Could Cuomo and",2018-11-13
AMZN,nytimes,"Amazon's Profit Swells to $1.6 Billion, Lifted by Its Cloud",2018-04-26
AMZN,nytimes,Cuomo and de Blasio Saw the Amazon Deal as a Winner.,2018-11-20
AMZN,nytimes,Can You Trust Amazon Vine Reviews? | Wirecutter,2018-06-25
AMZN,nytimes,Seattle Officials Repeal Tax That Upset Amazon,2018-06-12
AMZN,nytimes,"How Walmart, the Big Seller, Is Shopping for a Fight With",2018-05-09
AMZN,nytimes,"What Amazon's HQ2 Winners Look Like, Before Amazon",2018-11-15
AMZN,nytimes,What Amazon Could Learn From Google in New York City,2018-12-14
AMZN,nytimes,Opinion | The Amazon on the Brink,2018-09-26
AMZN,nytimes,Amazon Deal for Whole Foods Starts a Supermarket War,2017-06-16
AMZN,nytimes,Amazon Pushes Facial Recognition to Police. Critics See,2018-05-22
AMZN,nytimes,Documents: Authors and Booksellers Call for Amazon Inquiry,2015-07-13
AMZN,nytimes,"Amazon Wants You to Wake Up With Alexa, and That's Just",2017-09-27
AMZN,nytimes,Why Toronto Made 'the Playoffs' for Amazon's Headquarters,2018-01-18
AMZN,nytimes,"Playing Catch-Up With Walmart, Amazon Offers Digital",2018-08-08
AMZN,nytimes,Opinion | Earning More at Amazon (Maybe),2018-10-10
AMZN,nytimes,Amazon Sets Its Sights on the $88 Billion Online Ad Market,2018-09-03
AMZN,nytimes,Conglomerates Didn't Die. They Look Like Amazon,2017-06-19
AMZN,nytimes,Amazon Wins Approval to Test Delivery Drones Outdoors,2015-03-19
AMZN,nytimes,More Brands Mean Many More Buttons for Quirky Amazon,2016-03-31
AMZN,nytimes,Opinion | How California Can Save the Amazon,2018-08-29
AMZN,nytimes,Amazon's Antitrust Antagonist Has a Breakthrough Idea,2018-09-07
AMZN,nytimes,"Tech Hearings: Congress Unites to Take Aim at Amazon,",2019-07-16
AMZN,nytimes,Why Amazon Fires Keep Raging 10 Years After a Deal to,2019-10-18
AMZN,nytimes,Amazon Chooses Queens and a Washington Suburb for ',2018-11-12
AMZN,nytimes,"Amazon Effect, Meatball Edition",2018-02-02
AMZN,nytimes,Amazon-Whole Foods Deal Clears Last Two Major Hurdles,2017-08-23
AMZN,nytimes,Inside Amazon: Reporter's Notebook,2015-09-01
AMZN,nytimes,Amazon Is Used to Promote White Supremacist,2018-07-08
AMZN,nytimes,Labor's Hard Choice in Amazon Age: Play Along or Get,2019-02-22
AMZN,nytimes,What We Don't Know About Amazon's Split HQ2,2018-11-07
AMZN,nytimes,Brazilian Judge Stymies Plan to Allow Mining in Amazon,2017-08-30
AMZN,nytimes,"In Amazon Bid, New York Brags About, Well, Everything",2017-10-18
AMZN,nytimes,The Most Fun (and Useful) Things You Can Do With an,2018-09-19
AMZN,nytimes,Elizabeth Warren Proposes Breaking Up Tech Giants Like,2019-03-08
AMZN,nytimes,What Happens When 25000 Amazon Workers Flush Toilets?,2018-12-10
AMZN,nytimes,"Amazon, Berkshire Hathaway and JPMorgan Name C.E.O.",2018-06-20
AMZN,nytimes,Where Amazon May Build Its New Headquarters,2018-01-18
AMZN,nytimes,Amazon's Plan to Reach 500 Million Indians: Speak Their,2018-09-04
AMZN,nytimes,"The Best TV Shows and Movies New to Netflix, Amazon",2017-05-01
AMZN,nytimes,"To Trump, It's the 'Amazon Washington Post.' To Its Editor",2018-04-02
AMZN,nytimes,"In Queens, Amazon Deal's Demise Reveals Deep Divisions",2019-02-14
AMZN,nytimes,Amazon's Jobs Fair Sends Clear Message: Now Hiring,2017-08-02
AMZN,nytimes,Amazon Turns to More Free Grocery Delivery to Lift Food,2019-10-29
AMZN,nytimes,The Echo From Amazon Brims With Groundbreaking Promise,2016-03-09
AMZN,nytimes,"A Red Carpet for Amazon in Fall River, Mass., and Hopes",2016-03-29
AMZN,nytimes,The Mind-Boggling Ascent of Amazon and Jeff Bezos,2017-07-28
AMZN,nytimes,Amazon Counts Its Suitors: 238 Want to Be Home for 2nd,2017-10-23
AMZN,nytimes,Sam's Club Makes E-Commerce Push With Amazon Prime,2018-02-14
AMZN,nytimes,Amazon Offers Millions of Songs in High-Quality Audio.,2019-09-18
AMZN,nytimes,"Farhad's Week in Tech: Less Time on Facebook, More",2018-02-02
AMZN,nytimes,Amazon Faces E.U. Inquiry Over Data From Independent,2019-07-17
AMZN,nytimes,Amazon Reboots 'Citizen Kane' and 'E.T.' Studio,2018-04-18
AMZN,nytimes,"Hearing Amazon's Footsteps, the Health Care Industry",2017-10-27
AMZN,nytimes,Movie Studio by Amazon for Screens Big and Small,2015-01-19
AMZN,nytimes,What Satellite Imagery Tells Us About the Amazon Rain,2019-08-24
AMZN,nytimes,FedEx Says It's Ending Express Shipping Service for Amazon,2019-06-07
AMZN,nytimes,What Amazon Means for Long Island City,2018-11-22
AMZN,nytimes,"'Cortana, Open Alexa,' Amazon Says. And Microsoft Agrees",2017-08-30
AMZN,nytimes,Amazon and the Urban Hypocrite,2018-11-14
AMZN,nytimes,"Amazon Grows in New York, Reviving Debate Over",2019-12-09
AMZN,nytimes,"Amazon Plans Second Headquarters, Opening a Bidding",2017-09-07
AMZN,nytimes,Opinion | When Amazon Comes to Town,2017-06-20
AMZN,nytimes,"A Showdown Brews Between Amazon and Alibaba, Far",2017-10-22
AMZN,nytimes,A Deluge of Comments From Readers With an Opinion,2015-08-18
AMZN,nytimes,"Amazon Plans to Split HQ2 Between Long Island City,",2018-11-05
AMZN,nytimes,Netflix and Amazon Still Have Great New Movies and TV,2017-06-19
AMZN,nytimes,How Amazon's Long Game Yielded a Retail Juggernaut,2015-11-18
AMZN,nytimes,"Deep in Brazil's Amazon, Exploring the Ruins of Ford's",2017-02-20
AMZN,nytimes,FedEx Ends Amazon's U.S. Ground Deliveries as Retailer,2019-08-07
AMZN,nytimes,Special Ops With a Studious Bent Fight Destruction of,2017-04-06
AMZN,nytimes,"Amazon, Not Waiting for HQ2, Announces Projects in",2018-05-01
AMZN,nytimes,Next Up at Amazon-Run Whole Foods: Half-Priced Halibut,2018-05-16
AMZN,nytimes,"Joining Apple, Amazon's China Cloud Service Bows to",2017-08-01
AMZN,nytimes,Watching Video on Amazon Prime,2015-12-24
AMZN,nytimes,Miscue Calls Attention to Amazon's Dominance in Cloud,2017-03-12
AMZN,nytimes,What You Get (and What You Don't) From a $50 Amazon Fire,2017-06-06
AMZN,nytimes,3 Muslim Workers at Amazon File Federal Discrimination,2019-05-08
AMZN,nytimes,Amazon Rainforest Fires: Here's What's Really Happening,2019-08-28
AMZN,nytimes,How Amazon Wove Itself Into the Life of an American City,2019-11-30
AMZN,nytimes,Jeff Bezos Says He Is Selling $1 Billion a Year in Amazon,2017-04-05
AMZN,nytimes,Kohl's Is Betting on Amazon Returns to Drive Sales,2019-07-08
AMZN,nytimes,Walmart Plays Catch-Up With Amazon,2015-10-22
AMZN,nytimes,Why Some Amazon Workers Are Fuming About Their Raise,2018-10-09
AMZN,nytimes,Amazon to End Its Restaurant Delivery Service,2019-06-11
AMZN,nytimes,The Secret Life of Amazon's Vine Reviewers,2019-01-26
AMZN,nytimes,Amazon to Test a New Delivery Service for Sellers,2018-02-09
AMZN,nytimes,Best Buy's Secrets for Thriving in the Amazon Age,2017-09-18
AMZN,nytimes,Amazon Pauses Huge Development Plans in Seattle Over,2018-05-02
AMZN,nytimes,Amazon Introduces 2 Alexa Voice-Controlled Devices,2016-03-03
AMZN,nytimes,Everything on Amazon Is Amazon!,2018-11-15
AMZN,nytimes,Amazon's Homegrown Chips Threaten Silicon Valley Giant,2018-12-10
AMZN,nytimes,How Amazon Has Transformed the Hasidic Economy,2019-10-16
AMZN,nytimes,Amazon Offers Prime Discount for Medicaid Recipients,2018-03-07
AMZN,nytimes,"Jeremy Clarkson, Former 'Top Gear' Host, Announces Deal",2015-07-30
AMZN,nytimes,Amazon's Exit Forces a Reckoning for N.Y. Political Leaders,2019-02-14
AMZN,nytimes,Amazon Gears Up for New York Fashion Week for Men,2015-07-08
AMZN,nytimes,"Opinion | From Amazon, a Change That Hurts Authors",2017-10-12
AMZN,nytimes,Amazon's Curious Case of the $2630.52 Used Paperback,2018-07-15
AMZN,nytimes,The Amazon Effect: How Prices Dropped at Whole Foods,2017-08-28
AMZN,nytimes,"Chasing Amazon, Retailers Are in a Never-Ending Arms",2019-11-29
AMZN,nytimes,Google and Amazon Are at the Center of a Storm Brewing,2019-06-02
AMZN,nytimes,Amazon Sellers Brood as States Come Calling for Taxes,2017-11-15
AMZN,nytimes,Amazon Knows Why Alexa Was Laughing at Its Customers,2018-03-08
AMZN,nytimes,"With New Echo Speakers, Amazon Lets You Ask Alexa to",2017-05-09
AMZN,nytimes,"Trump, Having Denounced Amazon's Shipping Deal",2018-04-12
AMZN,nytimes,"Bit by Bit, Whole Foods Gets an Amazon Touch",2018-03-01
AMZN,nytimes,Amazon Prime Is Increasing to $119—Here's How,2018-04-27
AMZN,nytimes,Amazon to Share New Building With Homeless Shelter in,2017-05-10
AMZN,nytimes,Are Superstar Firms and Amazon Effects Reshaping the,2018-08-25
AMZN,nytimes,Amazon's Play to Rattle Whole Foods Rivals,2017-08-24
AMZN,nytimes,"Amazon Buys Ring, Maker of Smart Home Products",2018-02-27
AMZN,nytimes,"Amazon Pairs Its Speaker With Streaming Music, at a",2016-10-12
AMZN,nytimes,Amazon Sees in Brazil Continent-Size Profits and Problems,2018-12-27
AMZN,nytimes,Amazon Deal Meets New Resistance as Cuomo and N.Y.,2019-02-04
AMZN,nytimes,Amazon's New Neighbor: The Nation's Largest Housing,2018-11-12
AMZN,nytimes,Amazon's 'Black America' Imagines a New Nation in,2017-08-01
AMZN,nytimes,"Amazon Echo, a.k.a. Alexa, Is a Personal Aide in Need of",2015-06-24
AMZN,nytimes,Is Amazon Bad for the Postal Service? Or Its Savior?,2018-04-04
AMZN,nytimes,Jeff Bezos and Amazon Employees Join Debate Over Its,2015-08-17
AMZN,nytimes,Amazon's First Fully Automated Factory Is Anything But,2019-10-21
AMZN,nytimes,Retailers Race Against Amazon to Automate Stores,2018-04-01
AMZN,nytimes,Amazon Kindle Learns to Navigate Literary Thickets,2016-06-28
AMZN,nytimes,A Times Square Billboard Hits Ocasio-Cortez on Amazon.,2019-02-21
AMZN,nytimes,How to Get a $5000 Amazon Credit: Buy a House Through,2019-07-23
AMZN,nytimes,Amazon Has Big Plans for Alexa: Running the 'Star Trek',2016-08-07
AMZN,nytimes,Amazon Bets on an Empathetic Alexa,2019-03-03
AMZN,nytimes,Depiction of Amazon Stirs a Debate About Work Culture,2015-08-18
AMZN,nytimes,Jordan Peele Signs TV Deal With Amazon,2018-06-05
AMZN,nytimes,Alexandria Ocasio-Cortez Is Top 'Villain' in Amazon Pullout,2019-03-19
AMZN,nytimes,"After a Messy Breakup With New York, Amazon Is Back",2019-05-08
AMZN,nytimes,How Shipping Costs Have Put Amazon in a Bind,2018-04-27
AMZN,nytimes,Amazon Urged Not to Sell Facial Recognition Technology,2018-06-19
AMZN,nytimes,"Teaching Activities for: 'Inside Amazon Go, a Store of the",2018-01-23
AMZN,nytimes,Amazon's Literary Forays for TV: 'The Interestings' and 'The,2016-06-17
AMZN,nytimes,Amazon Users in India Will Get Less Choice and Pay More,2019-01-30
AMZN,nytimes,"Roy Moore, Yemen, Amazon: Your Tuesday Briefing",2017-12-05
AMZN,nytimes,Amazon Dreams Up a Sale in a Calendar Bursting With,2015-07-14
AMZN,nytimes,Brazil Angrily Rejects Millions in Amazon Aid Pledged at,2019-08-28
AMZN,nytimes,The Mystery of Amazon HQ2 Has Finalists Seeing Clues,2018-09-07
AMZN,nytimes,Amazon Prime Strikes Deal for Most PBS Children's Shows,2016-07-01
AMZN,nytimes,The Amazon-Walmart Showdown That Explains the,2017-06-16
AMZN,nytimes,Want to See What's Up Amazon's Sleeve? Take a Tour of,2018-09-23
AMZN,nytimes,Amazon Has a Business Proposition for You: Deliver Its,2018-06-28
AMZN,nytimes,The Secret Behind Amazon Package Delivery to West Africa,2019-12-31
AMZN,nytimes,An Amazon Warehouse Town Dreams of a Better Life,2019-12-27
AMZN,nytimes,Amazon Letter to the Federal Aviation Administration,2015-03-19
AMZN,nytimes,"The Facts Behind Trump's Tweets on Amazon, Taxes and",2018-03-29
AMZN,nytimes,"Amazon to Buy Online Pharmacy PillPack, Jumping Into",2018-06-28
AMZN,nytimes,"With 2020 in Sight, de Blasio Turns Against Amazon",2019-02-21
AMZN,nytimes,Opinion | A Look Inside Amazon,2015-08-22
AMZN,nytimes,An 'Amazon Effect' on Queens Real Estate? Here's Why,2018-12-27
AMZN,nytimes,Behind Amazon's Sudden Change in Its Film Strategy,2019-10-09
AMZN,nytimes,$16 Billion Bond Sale Shows Amazon's Power to Pursue,2017-08-16
AMZN,nytimes,Why Amazon's Push Into Prescription Drugs Isn't a,2018-07-02
AMZN,nytimes,"Amazon Flunks Children's Privacy, Advocacy Groups Charge",2019-05-09
AMZN,nytimes,EBay Accuses Amazon Managers of Conspiring to Poach,2019-08-01
AMZN,nytimes,Amazon Removes Holiday Ornaments With Images of,2019-12-01
AMZN,nytimes,Amazon Studios Chief Suspended After Sexual,2017-10-12
AMZN,nytimes,Woody Allen and Amazon Settle Breach of Contract Lawsuit,2019-11-09
AMZN,nytimes,Woody Allen Sues Amazon Over Canceled $68 Million Deal,2019-02-07
AMZN,nytimes,How Jeff Bezos Went to Hollywood and Lost Control,2019-03-02
AMZN,nytimes,"Move Over, Bill Gates. Jeff Bezos Gets a Turn as World's",2017-07-27
AMZN,nytimes,"Jeff Bezos, Amazon C.E.O., and MacKenzie Bezos Finalize",2019-04-04
AMZN,nytimes,"At Last, Jeff Bezos Offers a Hint of His Philanthropic Plans",2017-06-15
AMZN,nytimes,Jeff Bezos Accuses National Enquirer of 'Extortion and,2019-02-07
AMZN,nytimes,Why Jeff Bezos Went to Medium With His Message,2019-02-08
AMZN,nytimes,"Jeff Bezos, Riding High, Defends Decision to Buy",2016-06-01
AMZN,nytimes,Jeff Bezos of Amazon and MacKenzie Bezos Plan to Divorce,2019-01-09
AMZN,nytimes,Washington Post Finds Itself in the Middle of the Jeff Bezos,2019-02-11
AMZN,nytimes,Jeff Bezos Jumps Into 'Dreamer' Fight With Gift for,2018-01-12
AMZN,nytimes,"Jeff Bezos Wants Ideas for Philanthropy, So He Asked Twitter",2017-06-15
AMZN,nytimes,The Riches of Jeff Bezos,2017-07-28
AMZN,nytimes,"Jeff Bezos Cites a Big Number, but Few Details, in Plan for",2018-09-21
AMZN,nytimes,"Jeff Bezos, Style Icon",2018-08-02
AMZN,nytimes,Proving Jeff Bezos' Claims of Blackmail and Extortion,2019-02-25
AMZN,nytimes,Opinion | The Sexts of Jeff Bezos and the Death of Privacy,2019-01-18
AMZN,nytimes,Jeff Bezos vs. The National Enquirer: How a Tabloid Tale,2019-02-08
AMZN,nytimes,Why Jeff Bezos' Divorce Should Worry Amazon Investors,2019-01-18
AMZN,nytimes,Jeff Bezos' First Major Political Donation Is $10 Million to,2018-09-05
AMZN,nytimes,"In This Space Race, Jeff Bezos and Elon Musk Are",2018-04-24
AMZN,nytimes,Why Jeff Bezos Should Push for Nobody to Get as Rich as,2018-09-19
AMZN,nytimes,Excerpts From Jeff Bezos' Blog Post Accusing National,2019-02-07
AMZN,nytimes,Jeff Bezos and the Trap of the Charitable-Industrial Complex,2018-09-23
AMZN,nytimes,"Jeff Bezos Unveils Blue Origin's Vision for Space, and a",2019-05-09
AMZN,nytimes,"Meet the Man Quietly Building the Tesla of Trucks, With Jeff",2019-07-02
AMZN,nytimes,Kevin's Week in Tech: Jeff Bezos Reminds Tech Who's Boss,2018-04-20
AMZN,nytimes,"At Mars, Jeff Bezos Hosted Roboticists, Astronauts, Other",2018-03-22
AMZN,nytimes,"Blue Origin, Jeff Bezos' Rocket Company, to Launch From",2015-09-15
AMZN,nytimes,Jeff Bezos' Blue Origin to Partner With 3 Companies on,2019-10-22
AMZN,nytimes,"Jeff Bezos, Blackmail and 'Below the Belt' Selfies",2019-02-08
AMZN,nytimes,"Jeff Bezos, Please Release Your Dirty Selfies",2019-02-10
AMZN,nytimes,Jeff Bezos Said He Was a Victim of Extortion and Blackmail,2019-02-08
AMZN,nytimes,"Jeff Bezos, de Amazon, es el nuevo Rey Midas",2017-08-02
AMZN,nytimes,¿De qué manera Jeff Bezos puede cambiar al mundo con,2018-09-23
AMZN,nytimes,Opinion | Jeff Bezos Isn't Afraid of Total Exposure,2019-02-08
AMZN,nytimes,"El dueño de Amazon, Jeff Bezos, defiende su decisión de",2016-06-06
AMZN,nytimes,"Jeff Bezos, Anna Wintour and Lin-Manuel Miranda Unveil",2019-11-22
AMZN,nytimes,"Hillary Clinton, Oprah Winfrey and Jeff Bezos Celebrate",2019-05-24
AMZN,nytimes,"Blue Origin, Jeff Bezos' Rocket Company, Passes an In-",2016-10-05
AMZN,nytimes,"Este es New Glenn, el cohete de Jeff Bezos que algún día",2016-09-19
GOOG,nytimes,How Google Took Over the Classroom,2017-05-13
GOOG,nytimes,'The Business of War': Google Employees Protest Work for,2018-04-04
GOOG,nytimes,The Case Against Google,2018-02-20
GOOG,nytimes,Google's 4000-Word Privacy Policy Is a Secret History of,2019-07-10
GOOG,nytimes,Google Is Fined $170 Million for Violating Children's,2019-09-04
GOOG,nytimes,Google Will Not Renew Pentagon Contract That Upset,2018-06-01
GOOG,nytimes,"Google Knows Where You've Been, but Does It Know Who",2018-09-12
GOOG,nytimes,Opinion | Is It Time to Break Up Google?,2017-04-22
GOOG,nytimes,Google Is Fined $57 Million Under Europe's Data Privacy,2019-01-21
GOOG,nytimes,Lesson of the Day: '6 Google Tricks That Will Turn You Into,2019-09-10
GOOG,nytimes,Google Walkout: Employees Stage Protest Over Handling,2018-11-01
GOOG,nytimes,What Google Learned From Its Quest to Build the Perfect,2016-02-25
GOOG,nytimes,Google Pledges to Invest $1 Billion to Ease Bay Area,2019-06-18
GOOG,nytimes,Google Ends Forced Arbitration for All Employee Disputes,2019-02-21
GOOG,nytimes,"Opinion | Good for Google, Bad for America",2019-08-01
GOOG,nytimes,Opinion | You're Not Alone When You're on Google,2019-05-17
GOOG,nytimes,Google Thinks I'm Dead,2017-12-16
GOOG,nytimes,Why Does Google Know Everything You've Bought on,2019-06-04
GOOG,nytimes,Google's Shadow Work Force: Temps Who Outnumber Full,2019-05-28
GOOG,nytimes,Tracking the Demise of My Marriage on Google Maps,2019-01-04
GOOG,nytimes,Opinion | Google Doesn't Want What's Best for Us,2017-08-12
GOOG,nytimes,Google Strikes Humble Tone While Promoting A.I.,2018-05-08
GOOG,nytimes,Google Antitrust Investigation Outlined by State Attorneys,2019-09-09
GOOG,nytimes,Google Is Teaching Children How to Act Online. Is It,2018-10-23
GOOG,nytimes,Google Is Trying Too Hard (or Not Hard Enough) to Diversify,2018-03-09
GOOG,nytimes,New Google Campus Accelerates Tech's March Into,2018-12-17
GOOG,nytimes,Google Hires Firm Known for Anti-Union Efforts,2019-11-20
GOOG,nytimes,Google Pledges $300 Million to Clean Up False News,2018-03-20
GOOG,nytimes,Why Google Glass Broke,2015-02-04
GOOG,nytimes,New Pressure on Google and YouTube Over Children's Data,2018-09-20
GOOG,nytimes,How a Pentagon Contract Became an Identity Crisis for,2018-05-30
GOOG,nytimes,Google Critic Ousted From Think Tank Funded by the Tech,2017-08-30
GOOG,nytimes,Europe Tried to Rein In Google. It Backfired,2016-04-18
GOOG,nytimes,How Google Photos Became a Perfect Jukebox for Our,2018-11-14
GOOG,nytimes,Google Finds Accounts Connected to Russia Bought,2017-10-09
GOOG,nytimes,Google Made $4.7 Billion From the News Industry in 2018,2019-06-09
GOOG,nytimes,"Attention, Amazon Shoppers: Google Wants Some of Your",2019-05-14
