ticker,site,headline,date
AAPL,reuters,"Apple moves to store iCloud keys in China, raising human",2018-02-23
AAPL,reuters,Apple breaches $1 trillion stock market valuation,2018-08-02
AAPL,reuters,Patience pays off for decades-long Apple shareholders,2018-08-02
AAPL,reuters,Apple's iPhone XR is company's best-selling model,2018-11-28
AAPL,reuters,China's 'fake' Apple stores thrive ahead of new iPhone,2015-09-23
AAPL,reuters,Apple lowers some iPhone prices outside U.S. to offset,2019-01-30
AAPL,reuters,Apple to start India manufacturing in coming months with,2017-02-17
AAPL,reuters,Apple invests $1 billion in Chinese ride-hailing service Didi,2016-05-12
AAPL,reuters,Apple's new San Francisco office could be a tool in tech,2016-03-02
AAPL,reuters,Apple Watch to be sold at Best Buy stores from August,2015-07-26
AAPL,reuters,India rejects Apple's plan to import used iPhones,2016-05-04
AAPL,reuters,"Apple, Accenture team up on iPhone, iPad apps for",2017-08-29
AAPL,reuters,Exclusive: Apple in talks with potential suppliers of sensors,2019-04-17
AAPL,reuters,Apple plans China iPhone trade-in program with Foxconn,2015-03-25
AAPL,reuters,"Apple, Samsung settle U.S. patent dispute",2018-06-27
AAPL,reuters,Apple says Uighurs targeted in iPhone attack but disputes,2019-09-06
AAPL,reuters,"Apple rebuilds mapping app, but will still tap TomTom",2018-06-29
AAPL,reuters,Apple cancels production boost for iPhone XR: Nikkei,2018-11-05
AAPL,reuters,Exclusive: Foxconn to begin assembling top-end Apple,2018-12-27
AAPL,reuters,"Amazon strikes deal with Apple to sell iPhones, iPads",2018-11-09
AAPL,reuters,Apple says it is removing VPN services from China App Store,2017-07-29
AAPL,reuters,"Two years after acquisition, Apple shuts social analytics",2015-12-16
AAPL,reuters,Exclusive: Apple mines big profits from Watch band,2015-06-17
AAPL,reuters,Apple finds more serious supplier problems as its audits,2018-03-07
AAPL,reuters,Apple's data shows a deepening dependence on China as,2019-08-28
AAPL,reuters,Apple says new California headquarters to open in April,2017-02-22
AAPL,reuters,"Channeling Steve Jobs, Apple seeks design perfection at",2017-02-06
AAPL,reuters,Apple employee died of self-inflicted gunshot wound-police,2016-04-28
AAPL,reuters,Apple sets up China data center to meet new cyber,2017-07-11
AAPL,reuters,U.S. jury awards Apple $539 million in Samsung patent retrial,2018-05-24
AAPL,reuters,"Apple design chief Jony Ive, Steve Jobs' confidant, to leave",2019-06-27
AAPL,reuters,China court bans sales of older iPhone models in Apple-,2018-12-10
AAPL,reuters,"Tesla, Apple among firms accused of aiding child labor in",2019-12-16
AAPL,reuters,"Apple, Amazon called out for 'incorrect' Taiwan, Hong Kong",2019-01-16
AAPL,reuters,Steve Jobs pre-Apple job application fetches,2018-03-16
AAPL,reuters,Apple's Siri learns Shanghainese as voice assistants race,2017-03-08
AAPL,reuters,Trump considering whether Apple should be exempt from,2019-11-20
AAPL,reuters,New Apple app launches in Britain that pays people to get fit,2016-05-05
AAPL,reuters,Australia's big banks team up to challenge Apple on mobile,2016-07-26
AAPL,reuters,Apple co-founder says Apple Card algorithm gave wife,2019-11-10
AAPL,reuters,Apple refused China request for source code in last two years,2016-04-19
AAPL,reuters,U.S. judge in Boston ordered Apple to help law,2016-04-08
AAPL,reuters,Apple's mettle in India tested in squabble over anti-spam app,2018-08-08
AAPL,reuters,Apple begins assembling iPhone SE in Bengaluru plant,2017-05-18
AAPL,reuters,U.S. Supreme Court rejects Apple e-books price-fixing,2016-03-07
AAPL,reuters,CIA sought to hack Apple iPhones from earliest days-The,2015-03-10
AAPL,reuters,Apple financing scheme may unlock U.S. carriers' iPhone,2015-09-10
AAPL,reuters,Apple raises production of iPhone 11 models by about 10%,2019-10-04
AAPL,reuters,Apple accused of pressuring game rivals in Japan - Nikkei,2018-08-15
AAPL,reuters,"Apple CEO calls $1 trillion value a ""milestone"" but not a focus",2018-08-02
AAPL,reuters,"Foxconn says Apple, Dell join its bid for Toshiba chip",2017-06-12
AAPL,reuters,Apple Watch detects irregular heart beat in large U.S. study,2019-03-16
AAPL,reuters,"For Apple and others, tin supply chain has ties to rebel-",2016-11-28
AAPL,reuters,Samsung takes fight to Apple with mobile wallet strategy,2016-06-21
AAPL,reuters,Apple's Tim Cook will give away all his money: Fortune,2015-03-26
AAPL,reuters,"S&P, Dow hit record highs as Apple climbs",2017-08-08
AAPL,reuters,"SunPower, Apple to build solar projects in China",2015-04-16
AAPL,reuters,Apple supplier Foxconn looks at producing display panels,2017-07-24
AAPL,reuters,Apple nears TV deal with Spielberg for 'Amazing Stories',2017-10-10
AAPL,reuters,Musikdienst Spotify rüstet sich mit Milliarden-Anleihe,2016-03-30
AAPL,reuters,Apple Inc bans Alex Jones app for 'objectionable content',2018-09-07
AAPL,reuters,U.S. apple farmers afraid they will be hurt by U.S.-China,2018-09-04
AAPL,reuters,Russia asks Google and Apple to remove Telegram from,2018-04-17
AAPL,reuters,Apple CEO Tim Cook calls for more global trade with China,2017-03-18
AAPL,reuters,Apple poaches senior self-driving engineer from Waymo,2018-06-15
AAPL,reuters,LVMH's digital drive takes time despite Apple hire,2016-09-26
AAPL,reuters,Bolivia's Morales a dictator? Apple's Siri says so (in Spanish),2019-11-06
AAPL,reuters,"Microsoft opens door to Android, Apple phone apps",2015-04-29
AAPL,reuters,Cyber researcher pulls public talk on hacking Apple's Face ID,2019-01-03
AAPL,reuters,Apple AirPod headphones available for sale after two-,2016-12-13
AAPL,reuters,"Trump, top aides talk trade with Apple CEO Cook at White",2018-04-25
AAPL,reuters,Billie Eilish dominates 2019 on Apple Music,2019-12-03
AAPL,reuters,"Apple's Cook, Facebook's Zuckerberg meet China's Xi in",2017-10-30
AAPL,reuters,'Pen-Pineapple-Apple-Pen' singer unveils extended,2016-10-28
AAPL,reuters,Taylor Swift's '1989' will not be offered on Apple Music,2015-06-19
AAPL,reuters,"Apple CEO Cook opposes Trump, backs 'dreamer'",2019-10-02
AAPL,reuters,Older women have higher heart disease risk with 'apple',2019-07-01
AAPL,reuters,Half-strength apple juice can help some kids get through,2016-05-02
AAPL,reuters,Indian state won't ease crackdown on crime despite Apple,2018-10-17
AAPL,reuters,FBI paid more than $1.3 million to break into San,2016-04-21
AAPL,reuters,Israeli firm helping FBI to open encrypted iPhone: report,2016-03-23
AAPL,reuters,FBI paid under $1 million to unlock San Bernardino iPhone,2016-04-29
AAPL,reuters,Apple gets critical iPhone technology in $600 million,2018-10-10
AAPL,reuters,"Designed in California, made in China - how the iPhone",2018-03-21
AAPL,reuters,U.S. congressman stirs backlash over healthcare versus,2017-03-07
AAPL,reuters,"Brazil's iPhone investment falls short on promises of jobs,",2015-04-13
AAPL,reuters,Google's latest iPhone rival off to a rocky start,2017-10-23
AAPL,reuters,Camping out for an iPhone,2016-09-15
AAPL,reuters,"Nigeria to seize $40 mln of jewellery, gold iPhone from ex-",2019-07-05
AAPL,reuters,Vietnamese researcher shows iPhone X face ID 'hack',2017-11-14
AAPL,reuters,Firma israelí ayuda FBI a desbloquear iPhone encriptado,2016-03-23
AAPL,reuters,苹果今年拟推出尺寸最大iPhone 屏幕可能接近6.5英寸--彭博,2018-02-26
AAPL,reuters,Steve Jobs bio says Disney CEO kept Jobs' condition a,2015-03-21
AAPL,reuters,"Steve Jobs movie wins reviewer praise, Oscar hopes",2015-09-06
AAPL,reuters,FDA clears radioactive drug for cancer that killed Steve Jobs,2018-01-26
AAPL,reuters,"ENTREVISTA-'Steve Jobs' es un retrato entrañable, dice ex",2015-10-12
AAPL,reuters,Giant screens across UK bring David Hockney iPad,2017-02-09
AMZN,reuters,Insight - Amazon scraps secret AI recruiting tool that,2018-10-09
AMZN,reuters,Amazon buys startup Ring in $1 billion deal to run your,2018-02-27
AMZN,reuters,Amazon's automated grocery store of the future opens,2018-01-21
AMZN,reuters,Amazon says over 5 billion items shipped in 2017 via Prime,2018-01-02
AMZN,reuters,"Amazon to buy Whole Foods for $13.7 billion, wielding",2017-06-16
AMZN,reuters,Amazon to buy Israeli start-up Annapurna Labs,2015-01-22
AMZN,reuters,"Amazon raises minimum wage to $15, urges rivals to follow",2018-10-02
AMZN,reuters,Edward Hadas: Amazon's ultra-XY management style,2015-08-19
AMZN,reuters,"Amazon, facing entrenched rivals, says to shut China",2019-04-17
AMZN,reuters,"Amazon interested in buying Boost from T-Mobile, Sprint",2019-05-30
AMZN,reuters,"As fires race through Amazon, Brazil's Bolsonaro weakens",2019-08-28
AMZN,reuters,"XPO Logistics' top customer pulls back, Amazon suspected",2019-02-15
AMZN,reuters,Amazon.com wins $1.5 billion tax dispute over IRS,2017-03-23
AMZN,reuters,Amazon.com brings Prime service to Brazil; local retail,2019-09-09
AMZN,reuters,The sky never goes dark while the Amazon burns,2019-08-22
AMZN,reuters,Amazon launches new in-store pickup option with Rite Aid,2019-06-27
AMZN,reuters,Amazon to buy Middle Eastern online retailer Souq.com,2017-03-22
AMZN,reuters,"Amazon strikes deal with Apple to sell iPhones, iPads",2018-11-09
AMZN,reuters,Amazon under threat from deforestation and fires,2019-08-30
AMZN,reuters,Amazon buys cloud startup INLT to help merchants import,2019-09-24
AMZN,reuters,"Amazon, Samara buy India's 'More' retail chain for $580",2018-09-19
AMZN,reuters,Sprouts ended Amazon Prime Now delivery partnership on,2018-05-03
AMZN,reuters,Iliad's Free Launches Amazon Prime in France,2019-10-29
AMZN,reuters,Mexico's Televisa to create content for Amazon Prime,2018-02-22
AMZN,reuters,"Trump escalates attack on Amazon, focussing on tax",2018-03-29
AMZN,reuters,Amazon standoff,2019-03-03
AMZN,reuters,Amazon.com opens its own rainforest in Seattle,2018-01-29
AMZN,reuters,"Amazon earnings skyrocket on cloud computing, advertising",2018-07-26
AMZN,reuters,Amazon pulls kids clothes bearing 'Slavery gets shit done',2018-01-22
AMZN,reuters,"India tightens e-commerce rules, likely to hit Amazon, Flipkart",2018-12-27
AMZN,reuters,"Amazon to create 1800 jobs in France, Conforama to cut jobs",2019-07-01
AMZN,reuters,Amazon paid $90 million for camera maker's chip technology,2018-02-11
AMZN,reuters,Amazon founder Bezos' divorce final with $38 billion,2019-07-05
AMZN,reuters,"Apple, Amazon called out for 'incorrect' Taiwan, Hong Kong",2019-01-16
AMZN,reuters,Norway urges its companies in Brazil to safeguard the,2019-08-27
AMZN,reuters,"Seattle love, dread of activist investor help clinch Amazon",2017-06-16
AMZN,reuters,Amazon from above,2015-12-03
AMZN,reuters,"Battling 'biopiracy', scientists catalog the Amazon's genetic",2018-12-20
AMZN,reuters,Amazon And Ring Close Acquisition—Now Working,2018-04-12
AMZN,reuters,FedEx to end Amazon contract for FedEx Express plane,2019-06-07
AMZN,reuters,Amazon rolls out machines that pack orders and replace jobs,2019-05-13
AMZN,reuters,Ancient human tree cultivation shaped Amazon landscape,2017-03-02
AMZN,reuters,Peru's riverboat sentinels warn remote Amazon tribe of ',2017-12-08
AMZN,reuters,"Amazon delivers dazzling profits, as well as $20 Prime hike",2018-04-26
AMZN,reuters,Amazon likely to buy 7-8 percent stake in India's Future Retail,2018-10-16
AMZN,reuters,Amazon investigating claims of employees leaking data for,2018-09-17
AMZN,reuters,Bezos says Amazon to up India investment to $5 billion,2016-06-07
AMZN,reuters,MPs criticise Amazon.com's 'Webminster' tube ad campaign,2017-01-12
AMZN,reuters,Bolsonaro-backed highway targets heart of Brazil's Amazon,2019-10-02
AMZN,reuters,How will Amazon deliver in its second biggest market?,2019-10-23
AMZN,reuters,Norway stops Amazon fund contribution in dispute with Brazil,2019-08-15
AMZN,reuters,Amazon could challenge loss of $10 billion Pentagon,2019-10-28
AMZN,reuters,Pope asks forgiveness for theft of controversial Amazon,2019-10-25
AMZN,reuters,Amazon starts flexing muscle in new space - air cargo,2016-12-23
AMZN,reuters,"Woody Allen, Amazon end legal dispute over movie deal",2019-11-09
AMZN,reuters,Amazon squares up to Uber with backing for UK food app,2019-05-17
AMZN,reuters,"Amazon, Google join retailers in banning Confederate flag",2015-06-23
AMZN,reuters,Insight - 'Day of Fire': Blazes ignite suspicion in Amazon town,2019-09-11
AMZN,reuters,Amazon pulls child sex dolls after criticism from UK watchdog,2018-04-12
AMZN,reuters,"Amazon, Toyota, Alcoa and others working to counter",2018-07-20
AMZN,reuters,Amazon set to increase bet on Italy's digital turnaround plan,2016-07-21
AMZN,reuters,Amazon ads for Nazi-themed TV show pulled from N.Y.,2015-11-26
AMZN,reuters,Amazon's latest gadget - a self-driving toy car for coders,2018-11-28
AMZN,reuters,"Igniting global outrage, Brazil's Bolsonaro baselessly",2019-08-21
AMZN,reuters,Rabies spread by bats kills 12 in Peruvian Amazon,2016-02-10
AMZN,reuters,Musician Sting lauded for work to defend the Amazon as,2019-12-10
AMZN,reuters,Inside Amazon's Spheres,2018-01-29
AMZN,reuters,U.S. military joins Brazil army exercises in Amazon,2017-11-08
AMZN,reuters,Brazil's Amazon chief Raoni tapped for 2020 Nobel Peace,2019-09-14
AMZN,reuters,Postcards from the Amazon,2015-10-07
AMZN,reuters,Climate activists protest at Blackrock over investments in,2019-11-15
AMZN,reuters,"EU strikes deal forcing Netflix, Amazon to fund European",2018-04-26
AMZN,reuters,Amazon River overflows,2015-06-05
AMZN,reuters,Fish farmer Mowi could halt Brazil soy imports over,2019-08-28
AMZN,reuters,Brazil sends expedition to protect isolated Amazon tribe,2019-03-07
AMZN,reuters,Fight against illegal Amazon gold mining intensifies,2016-04-26
AMZN,reuters,BUZZ-India's Future Retail rises on report of Amazon,2018-10-15
AMZN,reuters,Amazon's Jeff Bezos commits $2 billion to help homeless,2018-09-13
AMZN,reuters,Amazon's Bezos gives $10 million to bipartisan campaign,2018-09-05
AMZN,reuters,Britain loses 1 bln stg through VAT fraud and error by,2017-04-19
AMZN,reuters,"Mexico's Walmart pressures suppliers on pricing, forcing",2019-04-08
AMZN,reuters,Amazon fish wears nature's 'bullet-proof vest' to thwart,2019-10-16
AMZN,reuters,Brazil's indigenous people swear to fight for Amazon 'to last,2019-08-23
AMZN,reuters,Amazon CEO Jeff Bezos and wife MacKenzie to divorce,2019-01-09
AMZN,reuters,Amazon tribe demands Bolsonaro stop mining on,2019-11-21
AMZN,reuters,Indigenous tribes grapple with wildfires and deforestation,2019-09-16
AMZN,reuters,Illegal loggers kill Amazon indigenous warrior who,2019-11-02
AMZN,reuters,Chocolate forests - Can cocoa help save the Amazon?,2018-04-11
AMZN,reuters,Amazon starts hiring own drivers in German last-mile,2019-09-17
AMZN,reuters,Bezos is selling $1 billion of Amazon stock a year to fund,2017-04-05
AMZN,reuters,Amazon's 'Jack Ryan' TV series lambasted for promoting,2019-09-06
AMZN,reuters,Jeff Bezos keeps Amazon voting power in divorce settlement,2019-04-04
AMZN,reuters,Rihanna stages fashion show for exclusive Amazon release,2019-09-10
AMZN,reuters,Amazon's Alexa will now butler at Marriott hotels,2018-06-19
AMZN,reuters,Chocolate forests: Can cocoa help restore the Amazon?,2018-04-11
AMZN,reuters,"'Kill your foster parents': Amazon's Alexa talks murder, sex",2018-12-21
AMZN,reuters,Amazon's 'The Marvelous Mrs. Maisel' wins best comedy at,2018-09-17
AMZN,reuters,"Flipkart, Amazon, others rush to pull vaping devices after",2019-09-19
AMZN,reuters,Amazon.com hit with trademark lawsuit by retailer Williams,2018-12-17
AMZN,reuters,"El célebre jugador de ""Fortnite"", Ninja, deja Twitch de",2019-08-01
AMZN,reuters,Amazon abandona un proyecto de IA para la contratación,2018-10-14
AMZN,reuters,Amazon despliega máquinas que empaquetan los pedidos,2019-05-13
AMZN,reuters,"Amazon, eBay y Google se unen a minoristas de EEUU",2015-06-23
AMZN,reuters,Backstory: Nine months after Lobo showed us an Amazon,2019-11-04
AMZN,reuters,Six farmers killed in apparent land dispute in Peru's Amazon,2017-09-07
AMZN,reuters,Amazon jaguar shot dead after Olympic torch ceremony,2016-06-21
AMZN,reuters,Amazon India says comic Gursimran Khamba embroiled in,2018-11-14
AMZN,reuters,Canadian man kills Brit in psychedelic ceremony in Peru's,2015-12-18
AMZN,reuters,British 'donkey whisperer' translates 'ee-aws' using,2016-07-27
GOOG,reuters,Google's YouTube to pay $170 million penalty for,2019-09-04
GOOG,reuters,Life at Google,2015-04-15
GOOG,reuters,Google suspends some business with Huawei after Trump,2019-05-20
GOOG,reuters,"Google uncovered Russia-backed ads on YouTube, Gmail",2017-10-09
GOOG,reuters,Google shifted $23 billion to tax haven Bermuda in 2017,2019-01-03
GOOG,reuters,Inside Google's push to shape the rules of the driverless road,2016-04-26
GOOG,reuters,"With Alphabet, Google faces a daunting challenge",2017-06-26
GOOG,reuters,Google's new gaming service will let game makers use,2019-03-20
GOOG,reuters,Google's self-driving car,2015-09-29
GOOG,reuters,Google fires employee behind anti-diversity memo,2017-08-07
GOOG,reuters,Google Translate mostly accurate in test with patient,2019-02-25
GOOG,reuters,France fines Google $57 million for European privacy rule,2019-01-21
GOOG,reuters,Google employees stage walkout,2018-11-01
GOOG,reuters,Google to charge Android partners up to $40 per device for,2018-10-19
GOOG,reuters,"Google to end ""Double Irish, Dutch sandwich"" tax scheme",2019-12-31
GOOG,reuters,"Factbox: New Alphabet chief started at Google, made",2019-12-04
GOOG,reuters,'Took away our identity': Google Maps puzzles residents,2019-07-04
GOOG,reuters,Google redesigns iconic logo for the fifth time,2015-09-01
GOOG,reuters,Google unveils quantum computer breakthrough; critics,2019-10-23
GOOG,reuters,"'We screwed up' not buying Google shares, Berkshire's",2019-05-04
GOOG,reuters,You have the right to be forgotten by Google - but only in,2019-09-24
GOOG,reuters,Aptoide wins court battle against Google in landmark case,2018-10-22
GOOG,reuters,Former Google CEO Schmidt to head new Pentagon,2016-03-02
GOOG,reuters,Italy looking at Google proposal to close tax dispute: source,2017-01-10
GOOG,reuters,Google app store gets more oversight,2015-03-17
GOOG,reuters,Google employees organize to fight cyber bullying at work,2018-03-31
GOOG,reuters,"Google responds to Trump, says no political motive in",2018-08-28
GOOG,reuters,"Google, Facebook move to restrict ads on fake news sites",2016-11-14
GOOG,reuters,Google's '#metoo' moment: Workers walk out over women's,2018-11-01
GOOG,reuters,"Google invests $700 million in Danish data centre, secures",2018-11-19
GOOG,reuters,Google defeats Zombie Go Boom 'Adpocalypse' lawsuit,2018-03-08
GOOG,reuters,GSK and Google parent forge $715 million bioelectronic,2016-08-01
GOOG,reuters,"Facebook, Google accused of anti-conservative bias at",2019-04-11
GOOG,reuters,Google poaches Morgan Stanley's CFO,2015-03-24
GOOG,reuters,Russia's Yandex seeks Google probe as market share falls,2015-02-18
GOOG,reuters,Competition Commission of India fines Google for abusing,2018-02-08
GOOG,reuters,"Google to open tech centre near Lisbon, creating 500 jobs",2018-01-24
GOOG,reuters,Google offers bug bounty to clean up mobile apps,2017-10-19
GOOG,reuters,Study finds Google system could improve breast cancer,2020-01-01
GOOG,reuters,Google's Clips camera is latest effort to bring AI into home,2018-02-27
GOOG,reuters,Google to remove Confederate flag from Google Shopping,2015-06-23
GOOG,reuters,Google co-founder Page backing two start-ups making,2016-06-09
GOOG,reuters,Vietnam set to tighten clamps on Facebook and Google,2018-05-18
GOOG,reuters,New Google CEO Pichai made ascent with low-key style,2015-08-10
GOOG,reuters,India's latest Google probe sparked by junior antitrust,2019-07-08
GOOG,reuters,Google halts political ads in Singapore as election looms,2019-12-03
GOOG,reuters,Google's self-driving car team beefs up auto experience,2016-03-03
GOOG,reuters,Google removes gaming apps with pop-up porn malware,2018-01-12
GOOG,reuters,"French finance minister rules out Google tax deal, more",2016-05-29
GOOG,reuters,Alphabet's new CEO Pichai now sole target on Google,2019-12-03
GOOG,reuters,Google's latest iPhone rival off to a rocky start,2017-10-23
GOOG,reuters,Lithuanian pleads guilty in U.S. to massive fraud against,2019-03-20
GOOG,reuters,Belgium to sue Google for not blurring images of defence,2018-09-28
GOOG,reuters,"Amazon, Google join retailers in banning Confederate flag",2015-06-23
GOOG,reuters,Apple says Uighurs targeted in iPhone attack but disputes,2019-09-06
GOOG,reuters,Burger King debuts Whopper ad that triggers Google Home,2017-04-12
GOOG,reuters,Google venture arm backs UK universal flu vaccine company,2018-01-14
GOOG,reuters,Exclusive: India orders anti-trust probe of Google for,2019-05-11
GOOG,reuters,Mapping startup Mapbox hires head of product from Google,2018-04-17
GOOG,reuters,India's InMobi ties up with China's APUS in bid to,2015-09-16
GOOG,reuters,Prostitute pleads guilty in Google executive's heroin death,2015-05-20
GOOG,reuters,"Biden campaign asks Facebook, Twitter and Google to",2019-10-11
GOOG,reuters,"Factbox: Trump on Twitter (Aug 28) - Google, Trump News",2018-08-28
GOOG,reuters,Israel counters Eurovision boycott campaign with Google ads,2019-05-10
GOOG,reuters,"Amazon, eBay y Google se unen a minoristas de EEUU",2015-06-23
GOOG,reuters,GSK y matriz de Google forman empresa para el desarrollo,2016-08-01
GOOG,reuters,Le patron de Google promu à la tête d'Alphabet,2019-12-03
GOOGL,reuters,"Facebook, Alphabet shifted in sector classification system",2018-01-11
GOOGL,reuters,"With Alphabet, Google faces a daunting challenge",2017-06-26
GOOGL,reuters,Alphabet names board veteran as chairman to succeed,2018-02-01
GOOGL,reuters,Alphabet's Sergey Brin says company must assume,2018-04-27
GOOGL,reuters,"In rare appearance, Larry Page discusses new Alphabet",2015-11-02
GOOGL,reuters,"J&J, Alphabet aim for smarter, smaller, cheaper surgical robot",2015-12-10
GOOGL,reuters,Alphabet names Nobel Prize winner Frances Arnold to board,2019-12-09
GOOGL,reuters,"Factbox: New Alphabet chief started at Google, made",2019-12-04
GOOGL,reuters,"Uber, Alphabet invest in bike sharing service Lime",2018-07-09
GOOGL,reuters,Alphabet's new CEO Pichai now sole target on Google,2019-12-03
GOOGL,reuters,Timeline: Autonomous car pioneer Levandowski faces,2019-08-27
GOOGL,reuters,Le patron de Google promu à la tête d'Alphabet,2019-12-03
MSFT,reuters,Microsoft co-founder Paul Allen dies of cancer,2018-10-15
MSFT,reuters,Microsoft to continue to invest over $1 billion a year on,2017-01-26
MSFT,reuters,"Microsoft co-founder Gates, Trump discuss innovation",2016-12-13
MSFT,reuters,Microsoft turned down facial-recognition sales on human,2019-04-16
MSFT,reuters,Microsoft to buy LinkedIn for $26.2 billion in its largest deal,2016-06-13
MSFT,reuters,Microsoft to invest $1 billion in OpenAI,2019-07-22
MSFT,reuters,"Microsoft, Samsung settle contract dispute over patents",2015-02-09
MSFT,reuters,Microsoft to warn email users of suspected hacking by,2015-12-30
MSFT,reuters,Microsoft Surface devices fail on reliability - Consumer,2017-08-10
MSFT,reuters,"Walmart, Microsoft in partnership to use cloud tech",2018-07-16
MSFT,reuters,"Microsoft's AI Twitter bot goes dark after racist, sexist tweets",2016-03-24
MSFT,reuters,"Microsoft opens door to Android, Apple phone apps",2015-04-29
MSFT,reuters,Microsoft buys Israeli digital pen maker N-trig: report,2015-02-12
MSFT,reuters,Microsoft co-founder Paul Allen dies at 65,2018-10-15
MSFT,reuters,Microsoft tackles China piracy with free upgrade to,2015-03-17
MSFT,reuters,GitLab gains developers after Microsoft buys rival GitHub,2018-06-05
MSFT,reuters,Toyota expands Microsoft partnership in connected vehicle,2016-04-04
MSFT,reuters,"Facebook, Twitter, YouTube, Microsoft back EU hate",2016-05-31
MSFT,reuters,"Dell, HP, Microsoft, Intel oppose proposed tariffs on laptops",2019-06-19
MSFT,reuters,Microsoft women filed 238 discrimination and harassment,2018-03-12
MSFT,reuters,A fresh Start - Microsoft's Windows 10 wins plaudits,2015-07-29
MSFT,reuters,Russia's Yandex teams up with Microsoft for Windows 10,2015-10-13
MSFT,reuters,"Paul Allen, uno de los fundadores de Microsoft, muere a",2018-10-16
TSLA,reuters,Tesla says self-driving hardware to be built into all its cars,2016-10-19
TSLA,reuters,Tesla's Elon Musk says transition from fossil fuels inevitable,2015-12-02
TSLA,reuters,Tesla owner lawsuit claims software update fraudulently,2019-08-08
TSLA,reuters,Tesla's big Model 3 bet rides on risky assembly line strategy,2017-04-23
TSLA,reuters,"Elon Musk says taking Tesla private is 'best path,' shares",2018-08-07
TSLA,reuters,"Tesla, Apple among firms accused of aiding child labor in",2019-12-16
TSLA,reuters,Fatal Tesla Autopilot crash driver had hands off wheel,2018-06-07
TSLA,reuters,Timeline - Tesla CEO Elon Musk's promises to investors,2018-05-03
TSLA,reuters,SolarCity advisor Lazard made mistake in deal with Tesla,2016-08-31
TSLA,reuters,"Tesla hikes prices for Model 3, other cars in China amid",2019-08-30
TSLA,reuters,SolarCity adviser Lazard made mistake in Tesla deal,2016-09-01
TSLA,reuters,Tesla shares get late boost on April Fool's press release,2015-04-01
TSLA,reuters,"BUZZ-U.S. STOCKS ON THE MOVE-Valeant Pharma,",2016-01-04
TSLA,reuters,expects profit from Tesla's Model 3 batteries by year-end,2017-07-31
TSLA,reuters,Commentary: Why Tesla is turning to Chile for its lithium,2018-02-07
TSLA,reuters,Porsche and Audi unveil electric cars to take on Tesla,2015-09-14
TSLA,reuters,Elon Musk owes $507 million to banks helping Tesla raise,2019-05-02
TSLA,reuters,Tesla's Musk is sued for calling Thai cave rescuer paedophile,2018-09-17
TSLA,reuters,U.S. SEC chairman says Tesla case is 'settled' despite,2018-11-26
TSLA,reuters,特斯拉推出新款Model 3轿车定价4.5万美元,2018-10-18
TSLA,reuters,Elon Musk outlines plans to put humans on Mars,2016-09-27
